instrument,alpha,key,text,label
NEO5-20,0.85,-1,Make demands on others.,Agreeableness
NEO5-20,0.9,-1,Mess things up.,Conscientiousness
NEO5-20,0.9,-1,Need a push to get started.,Conscientiousness
NEO5-20,0.91,1,Often feel blue.,Neuroticism
NEO5-20,0.89,-1,Rarely look for a deeper meaning in things.,Openness To Experience
NEO5-20,0.91,-1,Remain calm under pressure.,Neuroticism
NEO5-20,0.85,1,Respect others.,Agreeableness
NEO5-20,0.91,-1,Retreat from others.,Extraversion
NEO5-20,0.91,-1,Seldom get mad.,Neuroticism
NEO5-20,0.85,-1,Suspect hidden motives in others.,Agreeableness
NEO5-20,0.89,-1,Tend to vote for conservative political candidates.,Openness To Experience
NEO5-20,0.89,1,Tend to vote for liberal political candidates.,Openness To Experience
NEO5-20,0.85,1,Treat all people equally.,Agreeableness
NEO5-20,0.85,1,Trust what people say.,Agreeableness
NEO5-20,0.91,1,Warm up quickly to others.,Extraversion
ORAIS,0.69,1,Acted in a play.,Creativity/Originality
ORAIS,0.64,1,Ate candy.,Interest in Food
ORAIS,0.73,1,Ate dinner alone.,Reclusiveness
ORAIS,0.64,1,Ate food while walking or working.,Interest in Food
ORAIS,0.64,1,Ate in a restaurant.,Interest in Food
ORAIS,0.64,1,Ate or drank while driving.,Interest in Food
ORAIS,0.64,1,Ate too much.,Interest in Food
ORAIS,0.82,1,Attended a ballet performance.,Culture
ORAIS,0.89,1,Attended a church or religious service.,Spirituality/Religiousness
ORAIS,0.57,1,Attended a formal dance.,Interest in Romance
ORAIS,0.82,1,Attended a public lecture.,Culture
ORAIS,0.7,1,Attended a rally or demonstration.,Interest in Political Activism
ORAIS,0.82,1,Attended a stage play or musical.,Culture
ORAIS,0.7,1,Attended a town meeting.,Interest in Political Activism
ORAIS,0.79,1,Attended an athletic event.,Interest in Sports
ORAIS,0.82,1,Attended an opera or a concert.,Culture
ORAIS,0.75,1,"Baked a cake, pie, cookies, or bread.",Interest in Home-Making
ORAIS,0.84,1,Bathed or groomed a pet animal.,Interest in Pets
ORAIS,0.84,1,Became intoxicated.,Interest in Drinking
ORAIS,0.79,1,Bet money on a sports event.,Interest in Gambling
ORAIS,0.84,1,Bought a book about the things that I collect.,Interest in Collecting
ORAIS,0.75,1,Bought a book.,Love of Reading
ORAIS,0.5,1,"Bought a car, truck or motorcycle.",Interest in Vehicles
ORAIS,0.76,1,Bought a fashionable item of clothing.,Appearance-Consciousness
ORAIS,0.66,1,Bought a self-help book.,Interest in Self-Improvement
ORAIS,0.85,1,Bought or picked flowers.,Interest in Gardening
ORAIS,0.75,1,Bought or sold real estate.,Interest in Money
ORAIS,0.75,1,Bought or sold stocks or bonds.,Interest in Money
ORAIS,0.85,1,Bought plants for a garden or yard.,Interest in Gardening
ORAIS,0.84,1,Bought something for my collection.,Interest in Collecting
ORAIS,0.66,1,Bought something other than groceries.,Interest in Shopping
ORAIS,0.84,1,Cared for a pet animal.,Interest in Pets
ORAIS,0.85,1,Cared for a potted plant.,Interest in Gardening
ORAIS,0.52,1,Changed a habit to have less impact on the environment.,Interest in Environmentalism
ORAIS,0.66,1,Checked the sales ads in a newspaper.,Interest in Shopping
ORAIS,0.64,1,Chewed gum.,Interest in Food
ORAIS,0.73,1,Chose to spend a day by myself.,Reclusiveness
ORAIS,0.75,1,Cleaned the house.,Interest in Home-Making
ORAIS,0.52,1,Composted food scraps or yard waste.,Interest in Environmentalism
ORAIS,0.75,1,Cooked a meal.,Interest in Home-Making
ORAIS,0.85,1,Did aerobic exercise.,Interest in Exercise
ORAIS,0.85,1,Did yard work.,Interest in Gardening
ORAIS,0.85,1,Did yoga or other movement exercises.,Interest in Exercise
ORAIS,0.57,1,Dined by candle light.,Interest in Romance
ORAIS,0.89,1,Discussed religion or spirituality.,Spirituality/Religiousness
ORAIS,0.79,1,Discussed sports.,Interest in Sports
ORAIS,0.7,1,Donated money to a political campaign or cause.,Interest in Political Activism
ORAIS,0.7,1,Donated money to charity.,Interest in Political Activism
ORAIS,0.77,1,Downloaded music from the Internet.,Interest in Music
ORAIS,0.84,1,Drank beer or wine.,Interest in Drinking
ORAIS,0.84,1,Drank in a bar or night club.,Interest in Drinking
ORAIS,0.84,1,"Drank whiskey, vodka, gin, or other hard liquor.",Interest in Drinking
ORAIS,0.66,1,Enrolled in a course of study.,Interest in Self-Improvement
ORAIS,0.82,1,Entertained six or more people.,Interest in Pets
ORAIS,0.85,1,Exercised for 40 minutes or longer.,Interest in Exercise
ORAIS,0.84,1,Fed a pet animal.,Interest in Pets
ORAIS,0.79,1,Gambled on a slot machine or video poker game.,Interest in Gambling
ORAIS,0.79,1,Gambled with cards or dice.,Interest in Gambling
ORAIS,0.85,1,Gardened.,Interest in Gardening
ORAIS,0.89,1,Gave a blessing at a meal.,Spirituality/Religiousness
ORAIS,0.84,1,Had a hangover.,Interest in Drinking
ORAIS,0.82,1,Had someone over for dinner.,Gregariousness
ORAIS,0.75,1,Ironed linens or clothes.,Interest in Home-Making
ORAIS,0.75,1,"Knitted, quilted, sewed, or crocheted.",Interest in Home-Making
ORAIS,0.65,1,Learned a new board or card game.,Interest in Game-Playing
ORAIS,0.66,1,Learned a new skill.,Interest in Self-Improvement
ORAIS,0.86,1,Let a child win a game.,Interest in Children
ORAIS,0.85,1,Lifted weights.,Interest in Exercise
ORAIS,0.89,1,Listened to a religious program on the radio or TV.,Spirituality/Religiousness
ORAIS,0.77,1,Listened to music on the radio.,Interest in Music
ORAIS,0.77,1,Listened to music while working.,Interest in Music
ORAIS,0.61,1,Looked something up in an encyclopedia.,Love of Learning
ORAIS,0.61,1,Looked up a word in a dictionary.,Love of Learning
ORAIS,0.89,1,Looked up information on the Internet.,Interest in Computing
ORAIS,0.75,1,Made a bed.,Interest in Home-Making
ORAIS,0.6,1,Made an entry in a diary or journal.,Interest in Journaling
ORAIS,0.69,1,Made an entry on a personal web-page.,Interest in Social Media
ORAIS,0.75,1,Obtained stock market prices.,Interest in Money
ORAIS,0.64,1,Ordered food to be delivered.,Interest in Food
ORAIS,0.69,1,Painted a picture.,Creativity/Originality
ORAIS,0.85,1,Participated in an exercise program.,Interest in Exercise
ORAIS,0.69,1,Participated in an online discussion group.,Interest in Social Media
ORAIS,0.52,1,Picked up litter.,Interest in Environmentalism
ORAIS,0.82,1,Planned a party.,Gregariousness
ORAIS,0.85,1,Planted or transplanted a plant.,Interest in Gardening
ORAIS,0.65,1,Played a board game.,Interest in Game-Playing
ORAIS,0.89,1,Played a computer game.,Interest in Computing
ORAIS,0.69,1,Played a musical instrument.,Creativity/Originality
ORAIS,0.79,1,Played a team sport.,Interest in Sports
ORAIS,0.79,1,Played basketball.,Interest in Sports
ORAIS,0.79,1,Played bingo for money.,Interest in Gambling
ORAIS,0.65,1,Played cards.,Interest in Game-Playing
ORAIS,0.65,1,Played chess or checkers.,Interest in Game-Playing
ORAIS,0.79,1,Played tennis or golf.,Interest in Sports
ORAIS,0.86,1,Played with a child.,Interest in Children
ORAIS,0.84,1,Played with a pet animal.,Interest in Pets
ORAIS,0.89,1,Prayed (not including blessings at meals).,Spirituality/Religiousness
ORAIS,0.69,1,Produced a work of art.,Creativity/Originality
ORAIS,0.75,1,Purchased a commodity as an investment.,Interest in Money
ORAIS,0.77,1,Purchased a musical album.,Interest in Music
ORAIS,0.84,1,Purchased a pet animal.,Interest in Pets
ORAIS,0.79,1,Purchased a scratch ticket.,Interest in Gambling
ORAIS,0.6,1,Put pictures in a photo album.,Interest in Journaling
ORAIS,0.5,1,"Raced a car, truck or motorcycle.",Interest in Vehicles
ORAIS,0.89,1,Read a book about religion or spirituality.,Spirituality/Religiousness
ORAIS,0.84,1,Read a book about the things that I collect.,Interest in Collecting
ORAIS,0.75,1,Read a book on a financial topic.,Interest in Money
ORAIS,0.75,1,Read a book.,Love of Reading
ORAIS,0.5,1,Read a car magazine or book.,Interest in Vehicles
ORAIS,0.76,1,Read a fashion-related book.,Appearance-Consciousness
ORAIS,0.76,1,Read a fashion-related magazine.,Appearance-Consciousness
ORAIS,0.61,1,Read a news magazine.,Love of Learning
ORAIS,0.66,1,Read a self-help book.,Interest in Self-Improvement
ORAIS,0.86,1,Read a story to a child.,Interest in Children
ORAIS,0.75,1,Read an entire book in one sitting.,Love of Reading
ORAIS,0.75,1,Read in bed before going to sleep.,Love of Reading
ORAIS,0.77,1,Read music-related news.,Interest in Music
ORAIS,0.89,1,Read news on the Internet.,Interest in Computing
ORAIS,0.66,1,Read newspaper ads for non-grocery items.,Interest in Shopping
ORAIS,0.61,1,Read poetry.,Love of Learning
ORAIS,0.69,1,Read someone’s personal web-page.,Interest in Social Media
ORAIS,0.89,1,Read the Bible or other sacred text.,Spirituality/Religiousness
ORAIS,0.86,1,Read the comics to a child.,Interest in Children
ORAIS,0.61,1,Read the editorial page of a newspaper.,Love of Learning
ORAIS,0.61,1,Recorded a television program.,Interest in Watching Television
ORAIS,0.52,1,Recycled one or more items.,Interest in Environmentalism
ORAIS,0.5,1,Rode a motorcycle.,Interest in Vehicles
ORAIS,0.69,1,Sang or played an instrument in public.,Creativity/Originality
ORAIS,0.89,1,Sent a message by electronic mail (e-mail).,Interest in Computing
ORAIS,0.86,1,Served as a baby sitter.,Interest in Children
ORAIS,0.77,1,Shopped in a music store.,Interest in Music
ORAIS,0.66,1,Shopped on the web.,Interest in Shopping
ORAIS,0.7,1,Signed a petition.,Interest in Political Activism
ORAIS,0.66,1,Spent 10 minutes or more in a non-grocery store.,Interest in Shopping
ORAIS,0.73,1,Spent an entire vacation by myself.,Reclusiveness
ORAIS,0.66,1,Spent an hour or more in a non-grocery store.,Interest in Shopping
ORAIS,0.76,1,Spent more than 10 minutes thinking about what to wear.,Appearance-Consciousness
ORAIS,0.76,1,Spent more than an hour thinking about what to wear.,Appearance-Consciousness
ORAIS,0.79,1,"Stayed in a hotel, motel, or resort.",Interest in Travel
ORAIS,0.66,1,Studied some subject.,Interest in Self-Improvement
ORAIS,0.89,1,Surfed the Internet.,Interest in Computing
ORAIS,0.86,1,Took a child on an outing.,Interest in Children
ORAIS,0.79,1,Took a trip.,Interest in Travel
ORAIS,0.79,1,Took travel photographs.,Interest in Travel
ORAIS,0.77,1,Traded music with a friend.,Interest in Music
ORAIS,0.84,1,Traded something in my collection.,Interest in Collecting
ORAIS,0.79,1,Traveled by train or plane.,Interest in Travel
ORAIS,0.69,1,Tried something completely new.,Creativity/Originality
ORAIS,0.69,1,Used a computer for social networking.,Interest in Social Media
ORAIS,0.89,1,Used a computer.,Interest in Computing
ORAIS,0.85,1,Used an exercise machine.,Interest in Exercise
ORAIS,0.77,1,Used an mp3 player or Ipod.,Interest in Music
ORAIS,0.52,1,Used both sides of a piece of paper before discarding it.,Interest in Environmentalism
ORAIS,0.66,1,Used eBay to buy or sell something.,Interest in Shopping
ORAIS,0.69,1,Used instant messaging to chat online.,Interest in Social Media
ORAIS,0.52,1,Used public transportation.,Interest in Environmentalism
ORAIS,0.82,1,Visited a museum.,Culture
ORAIS,0.75,1,Visited a public library.,Love of Reading
ORAIS,0.82,1,Visited an art exhibition.,Culture
ORAIS,0.7,1,Volunteered for a club or organization.,Interest in Political Activism
ORAIS,0.74,1,Walked on a beach.,Interest in Outdoor Activities
ORAIS,0.52,1,Walked or rode a bicycle to work.,Interest in Environmentalism
ORAIS,0.75,1,Washed dishes.,Interest in Home-Making
ORAIS,0.79,1,Watched a televised sports event.,Interest in Sports
ORAIS,0.61,1,Watched a television reality show.,Interest in Watching Television
ORAIS,0.61,1,Watched a television soap opera.,Interest in Watching Television
ORAIS,0.61,1,Watched a television talk show.,Interest in Watching Television
ORAIS,0.61,1,Watched an educational channel on TV.,Love of Learning
ORAIS,0.61,1,Watched television news.,Interest in Watching Television
ORAIS,0.61,1,Watched television.,Interest in Watching Television
ORAIS,0.61,1,Watched too much television.,Interest in Watching Television
ORAIS,0.74,1,Went backpacking or camping.,Interest in Outdoor Activities
ORAIS,0.74,1,Went boating or rafting.,Interest in Outdoor Activities
ORAIS,0.57,1,Went dancing.,Interest in Romance
ORAIS,0.74,1,Went fishing or hunting.,Interest in Outdoor Activities
ORAIS,0.79,1,Went on a cruise or tour.,Interest in Travel
ORAIS,0.57,1,Went on a date.,Interest in Romance
ORAIS,0.74,1,Went on a hike.,Interest in Outdoor Activities
ORAIS,0.74,1,Went on a picnic.,Interest in Outdoor Activities
ORAIS,0.73,1,Went on a trip by myself.,Reclusiveness
ORAIS,0.85,1,Went running or jogging.,Interest in Exercise
ORAIS,0.79,1,Went sightseeing.,Interest in Travel
ORAIS,0.74,1,Went swimming.,Interest in Outdoor Activities
ORAIS,0.79,1,Went to a casino.,Interest in Gambling
ORAIS,0.73,1,Went to a concert or theater alone.,Reclusiveness
ORAIS,0.82,1,Went to a large party.,Gregariousness
ORAIS,0.82,1,Went to a small party.,Gregariousness
ORAIS,0.73,1,Went to the movies alone.,Reclusiveness
ORAIS,0.57,1,Wore formal clothing.,Interest in Romance
ORAIS,0.65,1,Worked on a jigsaw puzzle.,Interest in Game-Playing
ORAIS,0.75,1,Worked on a retirement plan.,Interest in Money
ORAIS,0.6,1,Worked on a scrap book.,Interest in Journaling
ORAIS,0.84,1,Worked on my collection.,Interest in Collecting
ORAIS,0.6,1,Wrote a handwritten letter.,Interest in Journaling
ORAIS,0.7,1,Wrote a letter to a newspaper or politician.,Interest in Political Activism
ORAIS,0.57,1,Wrote a love letter.,Interest in Romance
ORAIS,0.6,1,Wrote a postcard.,Interest in Journaling
ORAIS,0.6,1,Wrote a thank-you note.,Interest in Journaling
ORAIS,0.6,1,Wrote poetry.,Interest in Journaling
ORAIS,0.69,1,Wrote poetry.,Creativity/Originality
ORVIS,0.88,1,Act in a play.,Creativity/Originality
ORVIS,0.82,1,Be a bounty hunter,Adventurousness
ORVIS,0.88,1,Be a chemist,Science Interest
ORVIS,0.86,1,Be a counselor or therapist,Altruism
ORVIS,0.86,1,Be a doctor or nurse,Altruism
ORVIS,0.81,1,Be a farmer,Construction/Mechanical Interests
ORVIS,0.79,1,Be a foreign correspondent,Language Mastery
ORVIS,0.81,1,Be a forest ranger,Construction/Mechanical Interests
ORVIS,0.79,1,Be a librarian,Language Mastery
ORVIS,0.82,1,Be a long-distance bicycle rider,Adventurousness
ORVIS,0.88,1,Be a mathematician,Science Interest
ORVIS,0.82,1,Be a military officer,Adventurousness
ORVIS,0.86,1,"Be a minister, priest, rabbi or other religious teacher",Altruism
ORVIS,0.86,1,Be a physical therapist,Altruism
ORVIS,0.88,1,Be a physicist,Science Interest
ORVIS,0.82,1,Be a police officer,Adventurousness
ORVIS,0.82,1,Be a professional athlete,Adventurousness
ORVIS,0.88,1,Be a professional dancer,Creativity/Originality
ORVIS,0.79,1,Be a professor of English,Language Mastery
ORVIS,0.9,1,Be a purchasing agent,Organization
ORVIS,0.82,1,Be a racing car driver,Adventurousness
ORVIS,0.87,1,Be a sales or marketing director,Leadership
ORVIS,0.88,1,Be a scientific reporter,Science Interest
ORVIS,0.86,1,Be a social worker,Altruism
ORVIS,0.87,1,Be a state governor or senator,Leadership
ORVIS,0.88,1,Be a statistician,Science Interest
ORVIS,0.79,1,Be a translator or interpreter,Language Mastery
ORVIS,0.88,1,Be an actor or actress,Creativity/Originality
ORVIS,0.88,1,Be an artist or architect,Creativity/Originality
ORVIS,0.86,1,Be an elementary-school teacher,Altruism
ORVIS,0.9,1,Be an office manager,Organization
ORVIS,0.87,1,Be the chief executive of a large company,Leadership
ORVIS,0.9,1,Be the financial officer for a company,Organization
ORVIS,0.87,1,Be the master of ceremonies at a meeting,Leadership
ORVIS,0.81,1,Care for cattle or horses,Construction/Mechanical Interests
ORVIS,0.86,1,Care for sick people,Altruism
ORVIS,0.88,1,Carry out medical research,Science Interest
ORVIS,0.82,1,Compete in athletic events,Adventurousness
ORVIS,0.81,1,Construct new buildings,Construction/Mechanical Interests
ORVIS,0.86,1,Counsel persons who need help,Altruism
ORVIS,0.88,1,Create new fashion designs,Creativity/Originality
ORVIS,0.88,1,Create works of art,Creativity/Originality
ORVIS,0.81,1,Cultivate plants,Construction/Mechanical Interests
ORVIS,0.87,1,Debate topics in a public meeting,Leadership
ORVIS,0.88,1,Design a laboratory experiment,Science Interest
ORVIS,0.88,1,Design Internet web pages,Creativity/Originality
ORVIS,0.88,1,Develop a computer program,Science Interest
ORVIS,0.9,1,Develop an office filing system,Organization
ORVIS,0.81,1,Do woodworking,Construction/Mechanical Interests
ORVIS,0.79,1,Edit a newspaper,Language Mastery
ORVIS,0.82,1,Engage in exciting adventures,Adventurousness
ORVIS,0.9,1,Establish time schedules,Organization
ORVIS,0.88,1,Explain scientific concepts to others,Science Interest
ORVIS,0.82,1,Face physical danger,Adventurousness
ORVIS,0.81,1,Go on nature walks,Construction/Mechanical Interests
ORVIS,0.86,1,Help others learn new ideas,Altruism
ORVIS,0.86,1,Help people make career decisions,Altruism
ORVIS,0.86,1,Instruct parents on child care,Altruism
ORVIS,0.79,1,Keep a diary or journal,Language Mastery
ORVIS,0.9,1,Keep detailed records,Organization
ORVIS,0.9,1,Keep track of a company’s inventory,Organization
ORVIS,0.79,1,Know many languages,Language Mastery
ORVIS,0.87,1,Lead other people,Leadership
ORVIS,0.87,1,Make decisions that affect a lot of people,Leadership
ORVIS,0.87,1,Make important things happen,Leadership
ORVIS,0.79,1,Make up word puzzles,Language Mastery
ORVIS,0.9,1,Manage a computer data base,Organization
ORVIS,0.9,1,Monitor business expenses,Organization
ORVIS,0.87,1,Organize a political campaign,Leadership
ORVIS,0.88,1,Paint or draw,Creativity/Originality
ORVIS,0.86,1,Participate in charity events,Altruism
ORVIS,0.87,1,Persuade others to change their views,Leadership
ORVIS,0.87,1,Plan an advertising campaign,Leadership
ORVIS,0.9,1,Plan budgets,Organization
ORVIS,0.9,1,Plan investment strategies,Organization
ORVIS,0.88,1,Play an instrument in a symphony,Creativity/Originality
ORVIS,0.9,1,Prepare financial contracts,Organization
ORVIS,0.86,1,Provide comfort and support to others,Altruism
ORVIS,0.81,1,Raise flowers,Construction/Mechanical Interests
ORVIS,0.79,1,Read many books,Language Mastery
ORVIS,0.88,1,Redecorate one’s house,Creativity/Originality
ORVIS,0.81,1,Repair cars or trucks,Construction/Mechanical Interests
ORVIS,0.87,1,Run for political office,Leadership
ORVIS,0.88,1,Select art works for a museum,Creativity/Originality
ORVIS,0.88,1,Sing professionally,Creativity/Originality
ORVIS,0.88,1,Solve complex puzzles,Science Interest
ORVIS,0.79,1,Speak fluently on any subject,Language Mastery
ORVIS,0.9,1,Supervise the work of others,Organization
ORVIS,0.82,1,Survive in the wilderness,Adventurousness
ORVIS,0.81,1,Work with tools and machinery,Construction/Mechanical Interests
ORVIS,0.88,1,Write short stories or novels,Creativity/Originality
ORVIS,0.88,1,Write songs,Creativity/Originality
Radloff1977,0.93,1,Could not get going.,Depression
Radloff1977,0.93,1,"Did not feel like eating, even though I should have been hungry.",Depression
Radloff1977,0.93,-1,Enjoyed life.,Depression
Radloff1977,0.93,1,Felt depressed.,Depression
Radloff1977,0.93,1,Felt fearful.,Depression
Radloff1977,0.93,-1,Felt happy.,Depression
Radloff1977,0.93,-1,Felt hopeful about the future.,Depression
Radloff1977,0.93,1,Felt lonely.,Depression
Radloff1977,0.93,1,Felt sad.,Depression
Radloff1977,0.93,1,Felt that everything I did was an effort.,Depression
Radloff1977,0.93,1,"Felt that I could not shake off the blues, even with help from my family or friends.",Depression
Radloff1977,0.93,1,Felt that people disliked me.,Depression
Radloff1977,0.93,1,Had a poor appetite.,Depression
Radloff1977,0.93,1,Had crying spells.,Depression
Radloff1977,0.93,1,Had restless sleep.,Depression
Radloff1977,0.93,1,Had thoughts about death.,Depression
Radloff1977,0.93,1,Had trouble keeping my mind on what I was doing.,Depression
Radloff1977,0.93,1,Talked less than usual.,Depression
Radloff1977,0.93,1,Thought about killing myself.,Depression
Radloff1977,0.93,1,Thought my life had been a failure.,Depression
Radloff1977,0.93,1,Was bothered by things that usually don't bother me.,Depression
Radloff1977,0.93,1,Was down in the dumps.,Depression
Rosenberg1965,0.84,-1,Am less capable than most people.,Self-esteem
Rosenberg1965,0.84,-1,Dislike myself.,Self-esteem
Rosenberg1965,0.84,1,Feel comfortable with myself.,Self-esteem
Rosenberg1965,0.84,-1,Feel that I'm unable to deal with things.,Self-esteem
Rosenberg1965,0.84,-1,Feel that my life lacks direction.,Self-esteem
Rosenberg1965,0.84,1,Just know that I will be a success.,Self-esteem
Rosenberg1965,0.84,1,Know my strengths.,Self-esteem
Rosenberg1965,0.84,1,Like to take responsibility for making decisions.,Self-esteem
Rosenberg1965,0.84,-1,Question my ability to do my work properly.,Self-esteem
Rosenberg1965,0.84,1,Seldom feel blue.,Self-esteem
Scheier1994,0.86,-1,Am often in a bad mood.,Hope/Optimism
Scheier1994,0.86,-1,Dislike myself.,Hope/Optimism
Scheier1994,0.86,1,Feel comfortable with myself.,Hope/Optimism
Scheier1994,0.86,-1,Feel that my life lacks direction.,Hope/Optimism
Scheier1994,0.86,-1,Have a dark outlook on the future.,Hope/Optimism
Scheier1994,0.86,1,Just know that I will be a success.,Hope/Optimism
Scheier1994,0.86,1,Look at the bright side of life.,Hope/Optimism
Scheier1994,0.86,-1,Often feel blue.,Hope/Optimism
Scheier1994,0.86,1,Seldom feel blue.,Hope/Optimism
Snyder1974,0.82,1,Am good at making impromptu speeches.,Self-monitoring
Snyder1974,0.82,1,Am likely to show off if I get the chance.,Self-monitoring
Snyder1974,0.82,1,Am the life of the party.,Self-monitoring
Snyder1974,0.82,-1,Don't like to draw attention to myself.,Self-monitoring
Snyder1974,0.82,-1,Hate being the center of attention.,Self-monitoring
Snyder1974,0.82,1,Like to attract attention.,Self-monitoring
Snyder1974,0.82,1,Put on a show to impress people.,Self-monitoring
Snyder1974,0.82,1,Use flattery to get ahead.,Self-monitoring
Snyder1974,0.82,1,Would make a good actor.,Self-monitoring
Snyder1974,0.82,-1,Would not be a good comedian.,Self-monitoring
Span2002,0.78,1,Am often fidgety.,ADHD
Span2002,0.78,1,Begin to answer before the other person finishes the question.,ADHD
Span2002,0.78,1,Don't enjoy doing quiet leisure activities.,ADHD
Span2002,0.78,1,Don't finish the things that I start.,ADHD
Span2002,0.78,1,Don't pay enough attention when others are speaking to me.,ADHD
Span2002,0.78,1,Feel restless a lot of the time.,ADHD
Span2002,0.78,1,Find it difficult to organize tasks and activities.,ADHD
Span2002,0.78,1,Find it difficult to sit still for long periods of time.,ADHD
Span2002,0.78,1,Forget things.,ADHD
Span2002,0.78,1,Have been told I'm not listening when others are speaking to me.,ADHD
Span2002,0.78,1,Have difficulty keeping my attention on a task.,ADHD
Span2002,0.78,1,Make careless mistakes.,ADHD
TCI,0.75,1,Accept challenging tasks.,Competence
TCI,0.72,1,Accept others' weaknesses.,Compassion
TCI,0.72,1,Accept people as they are.,Tolerance
TCI,0.78,1,Accomplish a lot of work.,Industriousness/Perseverance/Persistence
TCI,0.73,1,Acknowledge others' accomplishments.,Trust
TCI,0.66,1,Act according to my conscience.,Morality
TCI,0.86,-1,Act comfortably with others.,Social-discomfort
TCI,0.71,-1,Agree to anything.,Hope/Optimism
TCI,0.72,-1,Am a bad loser.,Tolerance
TCI,0.78,1,Am able to control my cravings.,Impulse-Control
TCI,0.77,1,Am afraid of many things.,Self-efficacy
TCI,0.78,1,Am always on the go.,Industriousness/Perseverance/Persistence
TCI,0.72,-1,Am annoyed by others' mistakes.,Tolerance
TCI,0.86,1,Am apprehensive about new encounters.,Social-discomfort
TCI,0.86,-1,Am comfortable in unfamiliar situations.,Social-discomfort
TCI,0.83,-1,Am easily discouraged.,Resourcefulness
TCI,0.83,-1,Am easily intimidated.,Resourcefulness
TCI,0.8,1,Am easily moved to tears.,Sentimentality
TCI,0.72,-1,Am embarrassed to have people see my home.,Satisfaction
TCI,0.78,1,Am exacting in my work.,Industriousness/Perseverance/Persistence
TCI,0.72,1,Am inclined to forgive others.,Compassion
TCI,0.8,-1,Am indifferent to the feelings of others.,Sentimentality
TCI,0.74,1,Am inexplicably happy some of the time.,Romanticism
TCI,0.73,1,Am nice to store clerks.,Trust
TCI,0.86,-1,Am not bothered by difficult social situations.,Social-discomfort
TCI,0.72,-1,Am not in the mood for anything.,Satisfaction
TCI,0.78,-1,Am not interested in abstract ideas.,Imagination
TCI,0.65,-1,Am not interested in other people's problems.,Femininity
TCI,0.71,-1,Am not sure where my life is going.,Hope/Optimism
TCI,0.77,1,Am often down in the dumps.,Self-efficacy
TCI,0.86,1,Am often in a bad mood.,Neuroticism
TCI,0.86,1,Am open about my feelings.,Self-disclosure
TCI,0.8,1,Am open to change.,Variety-seeking
TCI,0.69,-1,Am out for my own personal gain.,Self-acceptance
TCI,0.74,1,Am passionate about anything I'm involved in.,Romanticism
TCI,0.74,1,Am passionate about causes.,Romanticism
TCI,0.69,-1,Am preoccupied with myself.,Self-acceptance
TCI,0.72,-1,Am quick to judge others.,Tolerance
TCI,0.86,1,Am quiet around strangers.,Social-discomfort
TCI,0.78,1,Am ready to do battle for a cause.,Industriousness/Perseverance/Persistence
TCI,0.71,-1,Am resigned to my fate.,Hope/Optimism
TCI,0.78,1,Avoid dangerous situations.,Harm-Avoidance
TCI,0.77,1,Become overwhelmed by events.,Self-efficacy
TCI,0.71,1,Believe in the importance of tradition.,Conservatism
TCI,0.71,1,Believe kids need tough love.,Conservatism
TCI,0.67,-1,Believe only in myself.,Conformity/Dependence/Need for approval
TCI,0.72,1,Believe that others have good intentions.,Tolerance
TCI,0.66,-1,Believe that the end justifies the means.,Morality
