instrument,alpha,key,text,label
Barchard2001,"0.75,0.74",1,Can't help but look upset when something bad happens.,Negative Expressivity
Barchard2001,"0.73,0.70",-1,Dislike being around happy people when I'm feeling sad.,Responsive Joy
Barchard2001,"0.73,0.70",-1,Dislike children's birthday parties.,Responsive Joy
Barchard2001,"0.64,0.80",-1,Don't like to get involved in other people's problems.,Empathy
Barchard2001,"0.81,0.79",1,Express my affection physically.,Positive Expressivity
Barchard2001,"0.81,0.79",1,Express my happiness in a childlike manner.,Positive Expressivity
Barchard2001,"0.64,0.80",-1,Feel little concern for others.,Empathy
Barchard2001,"0.73,0.70",1,Feel other people's joy.,Responsive Joy
Barchard2001,"0.64,0.80",1,Feel sympathy for those who are worse off than myself.,Empathy
Barchard2001,"0.81,0.79",-1,Find it difficult showing people that I care about them.,Positive Expressivity
Barchard2001,"0.75,0.74",-1,Find it difficult showing people that I'm angry with them.,Negative Expressivity
Barchard2001,"0.73,0.70",1,Find it hard to stay in a bad mood if the people around me are happy.,Responsive Joy
Barchard2001,"0.73,0.70",1,Get caught up in the excitement when others are celebrating.,Responsive Joy
Barchard2001,"0.81,0.79",-1,Have difficulty showing affection.,Positive Expressivity
Barchard2001,"0.64,0.80",-1,Have little sympathy for the unemployed.,Empathy
Barchard2001,"0.64,0.80",-1,Have no sympathy for criminals.,Empathy
Barchard2001,"0.81,0.79",1,Hug my close friends.,Positive Expressivity
Barchard2001,"0.75,0.74",-1,"Keep my feelings to myself, regardless of how scared I am.",Negative Expressivity
Barchard2001,"0.75,0.74",-1,"Keep my feelings to myself, regardless of how unhappy I am.",Negative Expressivity
Barchard2001,"0.81,0.79",-1,Keep my happy feelings to myself.,Positive Expressivity
Barchard2001,"0.81,0.79",1,Laugh out loud if something is funny.,Positive Expressivity
Barchard2001,"0.73,0.70",1,Like to watch children open presents.,Responsive Joy
Barchard2001,"0.73,0.67",-1,Listen to my brain rather than my heart.,Emotion-based Decision-making
Barchard2001,"0.73,0.67",1,Listen to my feelings when making important decisions.,Emotion-based Decision-making
Barchard2001,"0.73,0.67",1,Listen to my heart rather than my brain.,Emotion-based Decision-making
Barchard2001,"0.64,0.80",-1,Look down on any weakness.,Empathy
Barchard2001,"0.73,0.67",-1,"Make decisions based on facts, not feelings.",Emotion-based Decision-making
Barchard2001,"0.81,0.83",1,Notice my emotions.,Attention to Emotions
Barchard2001,"0.81,0.83",-1,Often ignore my feelings.,Attention to Emotions
Barchard2001,"0.81,0.83",1,Often stop to analyze how I'm feeling.,Attention to Emotions
Barchard2001,"0.81,0.83",1,Pay a lot of attention to my feelings.,Attention to Emotions
Barchard2001,"0.73,0.67",1,Plan my life based on how I feel.,Emotion-based Decision-making
Barchard2001,"0.73,0.67",-1,Plan my life logically.,Emotion-based Decision-making
Barchard2001,"0.81,0.83",-1,Rarely analyze my emotions.,Attention to Emotions
Barchard2001,"0.59,0.63",-1,Rarely cry during sad movies.,Responsive Distress
Barchard2001,"0.73,0.70",-1,Rarely get caught up in the excitement.,Responsive Joy
Barchard2001,"0.81,0.83",-1,Rarely notice my emotional reactions.,Attention to Emotions
Barchard2001,"0.75,0.74",-1,Rarely show my anger.,Negative Expressivity
Barchard2001,"0.81,0.83",-1,Rarely think about how I feel.,Attention to Emotions
Barchard2001,"0.59,0.63",-1,Remain calm during emergencies.,Responsive Distress
Barchard2001,"0.75,0.74",1,Shout or scream when I'm angry.,Negative Expressivity
Barchard2001,"0.75,0.74",1,Show my fear.,Negative Expressivity
Barchard2001,"0.81,0.79",1,Show my feelings when I'm happy.,Positive Expressivity
Barchard2001,"0.75,0.74",1,Show my sadness.,Negative Expressivity
Barchard2001,"0.81,0.79",1,Sometimes laugh out loud when reading or watching TV.,Positive Expressivity
Barchard2001,"0.59,0.63",1,Suffer from others' sorrows.,Responsive Distress
Barchard2001,"0.75,0.74",1,Suspect that my facial expressions give me away when I feel sad.,Negative Expressivity
Barchard2001,"0.64,0.80",1,Sympathize with the homeless.,Empathy
Barchard2001,"0.81,0.83",1,Think about the causes of my emotions.,Attention to Emotions
Barchard2001,"0.73,0.70",1,Usually end up laughing if the people around me are laughing.,Responsive Joy
Barchard2001,"0.75,0.74",-1,Wish I could more easily show my negative feelings.,Negative Expressivity
Barchard2001,"0.59,0.63",1,Would be upset if I saw an injured animal.,Responsive Distress
BFAS,0.81,1,Always know what I am doing.,Industriousness/Perseverance/Persistence
BFAS,0.89,1,Am a person whose moods go up and down easily.,Neuroticism
BFAS,0.89,1,Am a person whose moods go up and down easily.,Anger
BFAS,0.89,1,Am afraid of many things.,Neuroticism
BFAS,0.84,1,Am afraid of many things.,Anxiety
BFAS,0.89,1,Am easily discouraged.,Neuroticism
BFAS,0.84,1,Am easily discouraged.,Anxiety
BFAS,0.81,-1,Am easily distracted.,Industriousness/Perseverance/Persistence
BFAS,0.89,1,Am filled with doubts about things.,Neuroticism
BFAS,0.84,1,Am filled with doubts about things.,Anxiety
BFAS,0.81,-1,Am hard to get to know.,Vitality/Enthusiasm/Zest
BFAS,0.84,-1,Am indifferent to the feelings of others.,Compassion
BFAS,0.81,-1,Am not a very enthusiastic person.,Vitality/Enthusiasm/Zest
BFAS,0.89,-1,Am not easily annoyed.,Neuroticism
BFAS,0.89,-1,Am not easily annoyed.,Anger
BFAS,0.89,-1,Am not embarrassed easily.,Neuroticism
BFAS,0.84,-1,Am not embarrassed easily.,Anxiety
BFAS,0.84,-1,Am not interested in other people’s problems.,Compassion
BFAS,0.75,-1,Am out for my own personal gain.,Positive Expressivity
BFAS,0.84,1,Am quick to understand things.,Intellectual Openness
BFAS,0.84,1,Am quick to understand things.,Intellect
BFAS,0.85,1,Am the first to act.,Assertiveness
BFAS,0.84,-1,Avoid difficult reading material.,Intellectual Openness
BFAS,0.75,1,Avoid imposing my will on others.,Positive Expressivity
BFAS,0.84,-1,Avoid philosophical discussions.,Intellectual Openness
BFAS,0.84,-1,Avoid philosophical discussions.,Intellect
BFAS,0.89,1,Become overwhelmed by events.,Neuroticism
BFAS,0.84,1,Become overwhelmed by events.,Anxiety
BFAS,0.78,1,Believe in the importance of art.,Intellectual Openness
BFAS,0.78,1,Believe in the importance of art.,Aesthetic Appreciation/Artistic Interests
BFAS,0.75,-1,Believe that I am better than others.,Positive Expressivity
BFAS,0.89,1,Can be stirred up easily.,Neuroticism
BFAS,0.89,1,Can be stirred up easily.,Anger
BFAS,0.84,1,Can handle a lot of information.,Intellectual Openness
BFAS,0.84,1,Can handle a lot of information.,Intellect
BFAS,0.85,1,Can talk others into doing things.,Assertiveness
BFAS,0.84,-1,Can’t be bothered with other’s needs.,Compassion
BFAS,0.81,1,Carry out my plans.,Industriousness/Perseverance/Persistence
BFAS,0.89,1,Change my mood a lot.,Neuroticism
BFAS,0.89,1,Change my mood a lot.,Anger
BFAS,0.85,-1,Do not have an assertive personality.,Assertiveness
BFAS,0.78,-1,Do not like poetry.,Intellectual Openness
BFAS,0.78,-1,Do not like poetry.,Aesthetic Appreciation/Artistic Interests
BFAS,0.84,-1,Don’t have a soft side.,Compassion
BFAS,0.81,-1,Don’t put my mind on the task at hand.,Industriousness/Perseverance/Persistence
BFAS,0.78,1,Enjoy the beauty of nature.,Intellectual Openness
BFAS,0.78,1,Enjoy the beauty of nature.,Aesthetic Appreciation/Artistic Interests
BFAS,0.89,-1,Feel comfortable with myself.,Neuroticism
BFAS,0.84,-1,Feel comfortable with myself.,Anxiety
BFAS,0.84,1,Feel others’ emotions.,Compassion
BFAS,0.89,1,Feel threatened easily.,Neuroticism
BFAS,0.81,-1,Find it difficult to get down to work.,Industriousness/Perseverance/Persistence
BFAS,0.81,1,Finish what I start.,Industriousness/Perseverance/Persistence
BFAS,0.84,1,Formulate ideas clearly.,Intellectual Openness
BFAS,0.84,1,Formulate ideas clearly.,Intellect
BFAS,0.89,1,Get angry easily.,Neuroticism
BFAS,0.89,1,Get angry easily.,Anger
BFAS,0.78,1,Get deeply immersed in music.,Intellectual Openness
BFAS,0.78,1,Get deeply immersed in music.,Aesthetic Appreciation/Artistic Interests
BFAS,0.89,1,Get easily agitated.,Neuroticism
BFAS,0.89,1,Get easily agitated.,Anger
BFAS,0.81,1,Get things done quickly.,Industriousness/Perseverance/Persistence
BFAS,0.89,1,Get upset easily.,Neuroticism
BFAS,0.89,1,Get upset easily.,Anger
BFAS,0.75,1,Hate to seem pushy.,Positive Expressivity
BFAS,0.81,1,Have a lot of fun.,Vitality/Enthusiasm/Zest
BFAS,0.84,1,Have a rich vocabulary.,Intellectual Openness
BFAS,0.85,1,Have a strong personality.,Assertiveness
BFAS,0.84,-1,Have difficulty understanding abstract ideas.,Intellectual Openness
BFAS,0.85,-1,Hold back my opinions.,Assertiveness
BFAS,0.84,1,Inquire about others' well-being.,Compassion
BFAS,0.75,-1,Insult people.,Positive Expressivity
BFAS,0.89,-1,Keep my emotions under control.,Neuroticism
BFAS,0.89,-1,Keep my emotions under control.,Anger
BFAS,0.81,-1,Keep others at a distance.,Vitality/Enthusiasm/Zest
BFAS,0.8,1,Keep things tidy.,Orderliness
BFAS,0.85,1,Know how to captivate people.,Assertiveness
BFAS,0.85,-1,Lack the talent for influencing people.,Assertiveness
BFAS,0.81,1,Laugh a lot.,Vitality/Enthusiasm/Zest
BFAS,0.84,-1,Learn things slowly.,Intellectual Openness
BFAS,0.84,-1,Learn things slowly.,Intellect
BFAS,0.84,1,Like to do things for others.,Compassion
BFAS,0.84,1,Like to solve complex problems.,Intellectual Openness
BFAS,0.84,1,Like to solve complex problems.,Intellect
BFAS,0.75,-1,Love a good fight.,Positive Expressivity
BFAS,0.78,1,Love to reflect on things.,Intellectual Openness
BFAS,0.78,1,Love to reflect on things.,Aesthetic Appreciation/Artistic Interests
BFAS,0.81,1,Make friends easily.,Vitality/Enthusiasm/Zest
BFAS,0.81,-1,Mess things up.,Industriousness/Perseverance/Persistence
BFAS,0.78,1,Need a creative outlet.,Intellectual Openness
BFAS,0.78,1,Need a creative outlet.,Aesthetic Appreciation/Artistic Interests
BFAS,0.81,-1,Postpone decisions.,Industriousness/Perseverance/Persistence
BFAS,0.89,-1,Rarely feel depressed.,Neuroticism
BFAS,0.84,-1,Rarely feel depressed.,Anxiety
BFAS,0.81,-1,Rarely get caught up in the excitement.,Vitality/Enthusiasm/Zest
BFAS,0.89,-1,Rarely get irritated.,Neuroticism
BFAS,0.89,-1,Rarely get irritated.,Anger
BFAS,0.89,-1,Rarely lose my composure.,Neuroticism
BFAS,0.89,-1,Rarely lose my composure.,Anger
BFAS,0.75,1,Rarely put people under pressure.,Positive Expressivity
BFAS,0.75,1,Respect authority.,Positive Expressivity
BFAS,0.81,-1,Reveal little about myself.,Vitality/Enthusiasm/Zest
BFAS,0.78,1,See beauty in things that others might not notice.,Intellectual Openness
BFAS,0.78,1,See beauty in things that others might not notice.,Aesthetic Appreciation/Artistic Interests
BFAS,0.85,1,See myself as a good leader.,Assertiveness
BFAS,0.75,-1,Seek conflict.,Positive Expressivity
BFAS,0.78,-1,Seldom daydream.,Intellectual Openness
BFAS,0.78,-1,Seldom daydream.,Aesthetic Appreciation/Artistic Interests
BFAS,0.89,-1,Seldom feel blue.,Neuroticism
BFAS,0.84,-1,Seldom feel blue.,Anxiety
BFAS,0.78,-1,Seldom get lost in thought.,Intellectual Openness
BFAS,0.78,-1,Seldom get lost in thought.,Aesthetic Appreciation/Artistic Interests
BFAS,0.78,-1,Seldom notice the emotional aspects of paintings and pictures.,Intellectual Openness
BFAS,0.78,-1,Seldom notice the emotional aspects of paintings and pictures.,Aesthetic Appreciation/Artistic Interests
BFAS,0.81,1,Show my feelings when I'm happy.,Vitality/Enthusiasm/Zest
BFAS,0.84,1,Sympathize with others’ feelings.,Compassion
BFAS,0.75,-1,Take advantage of others.,Positive Expressivity
BFAS,0.84,1,Take an interest in other people’s lives.,Compassion
BFAS,0.84,-1,Take no time for others.,Compassion
BFAS,0.84,1,Think quickly.,Intellectual Openness
BFAS,0.84,1,Think quickly.,Intellect
BFAS,0.8,1,Want every detail taken care of.,Orderliness
BFAS,0.81,1,Warm up quickly to others.,Vitality/Enthusiasm/Zest
BFAS,0.81,-1,Waste my time.,Industriousness/Perseverance/Persistence
BFAS,0.89,1,Worry about things.,Neuroticism
BFAS-20,0.91,-1,Am a very private person.,Extraversion
BFAS-20,0.88,1,Am always prepared.,Conscientiousness
BFAS-20,0.91,-1,Am easily disturbed.,Emotional Stability
BFAS-20,0.88,1,Am exacting in my work.,Conscientiousness
BFAS-20,0.9,1,Am full of ideas.,Intellect
BFAS-20,0.9,1,Am good at many things.,Intellect
BFAS-20,0.88,-1,Am hard to get to know.,Agreeableness
BFAS-20,0.88,-1,Am indifferent to the feelings of others.,Agreeableness
BFAS-20,0.88,1,Am interested in people.,Agreeableness
BFAS-20,0.88,-1,Am not really interested in others.,Agreeableness
BFAS-20,0.88,1,Am on good terms with nearly everyone.,Agreeableness
BFAS-20,0.91,-1,Am quiet around strangers.,Extraversion
BFAS-20,0.91,1,Am the life of the party.,Extraversion
BFAS-20,0.91,-1,Bottle up my feelings.,Extraversion
BFAS-20,0.9,1,Catch on to things quickly.,Intellect
BFAS-20,0.91,-1,Change my mood a lot.,Emotional Stability
BFAS-20,0.88,1,Continue until everything is perfect.,Conscientiousness
BFAS-20,0.9,-1,Do not have a good imagination.,Intellect
BFAS-20,0.91,-1,Don't like to draw attention to myself.,Extraversion
BFAS-20,0.91,1,Don't mind being the center of attention.,Extraversion
BFAS-20,0.91,1,Feel at ease with people.,Extraversion
BFAS-20,0.91,1,Feel comfortable around people.,Extraversion
BFAS-20,0.88,-1,Feel little concern for others.,Agreeableness
BFAS-20,0.91,-1,Feel threatened easily.,Emotional Stability
BFAS-20,0.88,-1,Find it difficult to get down to work.,Conscientiousness
BFAS-20,0.88,1,Follow a schedule.,Conscientiousness
BFAS-20,0.91,-1,Get angry easily.,Emotional Stability
BFAS-20,0.91,-1,Get caught up in my problems.,Emotional Stability
BFAS-20,0.88,1,Get chores done right away.,Conscientiousness
BFAS-20,0.91,-1,Get irritated easily.,Emotional Stability
BFAS-20,0.91,-1,Get overwhelmed by emotions.,Emotional Stability
BFAS-20,0.91,-1,Get upset easily.,Emotional Stability
BFAS-20,0.91,-1,Grumble about things.,Emotional Stability
BFAS-20,0.88,1,Have a good word for everyone.,Agreeableness
BFAS-20,0.9,1,Have a vivid imagination.,Intellect
BFAS-20,0.9,-1,Have difficulty imagining things.,Intellect
BFAS-20,0.91,-1,Have little to say.,Extraversion
BFAS-20,0.88,1,Inquire about others' well-being.,Agreeableness
BFAS-20,0.91,1,Know how to captivate people.,Extraversion
BFAS-20,0.88,1,Know how to comfort others.,Agreeableness
BFAS-20,0.88,-1,Leave a mess in my room.,Conscientiousness
BFAS-20,0.88,-1,Leave my belongings around.,Conscientiousness
BFAS-20,0.88,1,Like to tidy up.,Conscientiousness
BFAS-20,0.88,1,Love children.,Agreeableness
BFAS-20,0.88,1,Love order and regularity.,Conscientiousness
BFAS-20,0.88,1,Love to help others.,Agreeableness
BFAS-20,0.9,1,Love to read challenging material.,Intellect
BFAS-20,0.9,1,Love to think up new ways of doing things.,Intellect
BFAS-20,0.88,-1,Make a mess of things.,Conscientiousness
BFAS-20,0.88,1,Make plans and stick to them.,Conscientiousness
BFAS-20,0.91,-1,Often feel uncomfortable around others.,Extraversion
BFAS-20,0.91,-1,Panic easily.,Emotional Stability
BFAS-20,0.91,1,Rarely get irritated.,Emotional Stability
BFAS-20,0.91,1,Seldom get mad.,Emotional Stability
BFAS-20,0.88,-1,Shirk my duties.,Conscientiousness
BFAS-20,0.88,1,Show my gratitude.,Agreeableness
BFAS-20,0.9,1,Spend time reflecting on things.,Intellect
BFAS-20,0.91,1,Start conversations.,Extraversion
BFAS-20,0.91,-1,Take offense easily.,Emotional Stability
BFAS-20,0.88,1,Take time out for others.,Agreeableness
BFAS-20,0.88,1,Think of others first.,Agreeableness
BFAS-20,0.91,-1,Wait for others to lead the way.,Extraversion
BFAS-20,0.88,-1,Waste my time.,Conscientiousness
BFAS-20,0.91,-1,Worry about things.,Emotional Stability
BIDR,0.87,1,Always admit it when I make a mistake.,Impression-Management
BIDR,0.8,1,Always know why I do things.,Self-deception
BIDR,0.79,-1,Always know why I do things.,Cognitive-Failures
BIDR,0.87,-1,Am likely to show off if I get the chance.,Impression-Management
BIDR,0.8,-1,Am not always honest with myself.,Self-deception
BIDR,0.87,-1,Am not always what I appear to be.,Impression-Management
BIDR,0.87,1,Believe there is never an excuse for lying.,Impression-Management
BIDR,0.87,-1,Break rules.,Impression-Management
BIDR,0.79,1,Can't make up my mind.,Cognitive-Failures
BIDR,0.87,-1,Cheat to get ahead.,Impression-Management
BIDR,0.8,-1,Dislike myself.,Self-deception
BIDR,0.87,-1,Don't always practice what I preach.,Impression-Management
BIDR,0.87,1,Easily resist temptations.,Impression-Management
BIDR,0.8,1,Feel comfortable with myself.,Self-deception
BIDR,0.87,-1,Get back at others.,Impression-Management
BIDR,0.79,1,Get confused easily.,Cognitive-Failures
BIDR,0.8,-1,Have a low opinion of myself.,Self-deception
BIDR,0.79,1,Have difficulty keeping things in mind.,Cognitive-Failures
BIDR,0.87,-1,Have sometimes had to tell a lie.,Impression-Management
BIDR,0.8,1,Just know that I will be a success.,Self-deception
BIDR,0.8,1,Know that my decisions are correct.,Self-deception
BIDR,0.79,1,Let my attention wander off.,Cognitive-Failures
BIDR,0.8,1,Like to take responsibility for making decisions.,Self-deception
BIDR,0.79,-1,Like to take responsibility for making decisions.,Cognitive-Failures
BIDR,0.87,-1,Misuse power.,Impression-Management
BIDR,0.79,1,Often forget things.,Cognitive-Failures
BIDR,0.79,-1,Pay attention to details.,Cognitive-Failures
BIDR,0.87,1,Rarely overindulge.,Impression-Management
BIDR,0.87,1,Rarely talk about sex.,Impression-Management
BIDR,0.79,-1,Remain calm under pressure.,Cognitive-Failures
BIDR,0.87,1,Return extra change when a cashier makes a mistake.,Impression-Management
BIDR,0.8,-1,Sometimes have trouble making up my mind.,Self-deception
BIDR,0.79,1,Spill things.,Cognitive-Failures
BIDR,0.87,1,Tell the truth.,Impression-Management
BIDR,0.87,1,Try to follow the rules.,Impression-Management
BIDR,0.87,-1,Use flattery to get ahead.,Impression-Management
BIDR,0.87,-1,Use swear words.,Impression-Management
BIDR,0.8,-1,Worry about what people think of me.,Self-deception
BIDR,0.87,1,Would never cheat on my taxes.,Impression-Management
BIDR,0.87,1,Would never take things that aren't mine.,Impression-Management
BIS_BAS,1994,1,Am afraid that I will do the wrong thing.,Behavioral Inhibition/Activation System
BIS_BAS,1994,1,Am always worried about something.,Behavioral Inhibition/Activation System
BIS_BAS,1994,1,Am always worried about something.,Anxiety
BIS_BAS,0.68,1,Am eager to soothe hurt feelings.,Excitement-seeking
BIS_BAS,1994,1,Am easily hurt.,Behavioral Inhibition/Activation System
BIS_BAS,0.77,-1,Am not an extraordinary person.,Ambition/Drive
BIS_BAS,1994,-1,Am not embarrassed easily.,Behavioral Inhibition/Activation System
BIS_BAS,0.77,-1,Am not highly motivated to succeed.,Ambition/Drive
BIS_BAS,0.79,1,Am willing to try anything once.,Risk-taking/Sensation-Seeking/Thrill-Seeking
BIS_BAS,0.79,-1,Avoid dangerous situations.,Risk-taking/Sensation-Seeking/Thrill-Seeking
BIS_BAS,1994,1,Become overwhelmed by events.,Behavioral Inhibition/Activation System
BIS_BAS,1994,1,Begin to panic when there is danger.,Behavioral Inhibition/Activation System
BIS_BAS,1994,1,Begin to panic when there is danger.,Anxiety
BIS_BAS,0.79,1,Do crazy things.,Risk-taking/Sensation-Seeking/Thrill-Seeking
BIS_BAS,0.68,-1,Don't get excited about things.,Excitement-seeking
BIS_BAS,0.79,1,Enjoy being reckless.,Risk-taking/Sensation-Seeking/Thrill-Seeking
BIS_BAS,0.68,1,Feel excited or happy for no apparent reason.,Excitement-seeking
BIS_BAS,0.68,1,Get caught up in the excitement when others are celebrating.,Excitement-seeking
BIS_BAS,0.68,1,Get so happy or energetic that I am almost giddy.,Excitement-seeking
BIS_BAS,1994,1,Get stressed out easily.,Behavioral Inhibition/Activation System
BIS_BAS,1994,1,Get stressed out easily.,Anxiety
BIS_BAS,0.77,-1,Hate being the center of attention.,Ambition/Drive
BIS_BAS,0.77,1,Have a strong need for power.,Ambition/Drive
BIS_BAS,0.79,1,Have persuaded others to do something really adventurous or crazy.,Risk-taking/Sensation-Seeking/Thrill-Seeking
BIS_BAS,0.77,1,Know how to get around the rules.,Ambition/Drive
BIS_BAS,0.79,1,Like to act on a whim.,Risk-taking/Sensation-Seeking/Thrill-Seeking
BIS_BAS,0.79,1,Like to behave spontaneously.,Risk-taking/Sensation-Seeking/Thrill-Seeking
BIS_BAS,0.77,1,Like to show off my body.,Ambition/Drive
BIS_BAS,1994,1,Often worry about things that turn out to be unimportant.,Behavioral Inhibition/Activation System
BIS_BAS,1994,1,Often worry about things that turn out to be unimportant.,Anxiety
BIS_BAS,0.79,1,Prefer friends who are excitingly unpredictable.,Risk-taking/Sensation-Seeking/Thrill-Seeking
BIS_BAS,0.77,1,Push myself very hard to succeed.,Ambition/Drive
BIS_BAS,0.79,-1,Rarely enjoy behaving in a silly manner.,Risk-taking/Sensation-Seeking/Thrill-Seeking
BIS_BAS,0.68,-1,Rarely get caught up in the excitement.,Excitement-seeking
BIS_BAS,1994,-1,Rarely worry.,Behavioral Inhibition/Activation System
BIS_BAS,1994,-1,Rarely worry.,Anxiety
BIS_BAS,0.77,1,Take charge.,Ambition/Drive
BIS_BAS,0.77,1,Try to surpass others' accomplishments.,Ambition/Drive
BIS_BAS,0.77,1,Want to be in charge.,Ambition/Drive
BIS_BAS,1994,1,Worry about what people think of me.,Behavioral Inhibition/Activation System
BIS_BAS,1994,1,Worry about what people think of me.,Anxiety
BIS_BAS,0.79,-1,Would never go hang gliding or bungee jumping.,Risk-taking/Sensation-Seeking/Thrill-Seeking
Buss1980,0.81,1,Am constantly reflecting about myself.,Introspection/Private Self-Consciousness
Buss1980,0.77,1,Am easily intimidated.,Public Self-consciousness
Buss1980,0.77,-1,Am not concerned with making a good impression.,Public Self-consciousness
Buss1980,0.77,-1,Am not easily bothered by things.,Public Self-consciousness
Buss1980,0.77,-1,Am not embarrassed easily.,Public Self-consciousness
Buss1980,0.81,-1,Don't try to figure myself out.,Introspection/Private Self-Consciousness
Buss1980,0.77,-1,Don't worry about things that have already happened.,Public Self-consciousness
Buss1980,0.81,1,Examine my motives constantly.,Introspection/Private Self-Consciousness
Buss1980,0.77,-1,Feel comortable with myself.,Public Self-consciousness
Buss1980,0.77,1,Feel threatened easily.,Public Self-consciousness
Buss1980,0.81,1,Like to get lost in thought.,Introspection/Private Self-Consciousness
Buss1980,0.81,1,Look for hidden meaning in things.,Introspection/Private Self-Consciousness
Buss1980,0.77,1,Need reassurance.,Public Self-consciousness
Buss1980,0.77,1,Need the approval of others.,Public Self-consciousness
Buss1980,0.81,-1,Rarely look for a deeper meaning in things.,Introspection/Private Self-Consciousness
Buss1980,0.81,-1,Seldom daydream.,Introspection/Private Self-Consciousness
Buss1980,0.77,-1,Seldom feel blue.,Public Self-consciousness
Buss1980,0.81,-1,Seldom get lost in thought.,Introspection/Private Self-Consciousness
Buss1980,0.81,1,Try to examine myself objectively.,Introspection/Private Self-Consciousness
Buss1980,0.77,1,Want to amount to something special in others' eyes.,Public Self-consciousness
Buss1980,0.77,1,Worry about what people think of me.,Public Self-consciousness
Cacioppo1982,0.93,1,Am quick to understand things.,Need for Cognition
Cacioppo1982,0.93,-1,Avoid difficult reading material.,Need for Cognition
Cacioppo1982,0.93,-1,Avoid philosophical discussions.,Need for Cognition
Cacioppo1982,0.93,1,Can handle a lot of information.,Need for Cognition
Cacioppo1982,0.93,-1,Have difficulty understanding abstract ideas.,Need for Cognition
Cacioppo1982,0.93,1,Like to solve complex problems.,Need for Cognition
Cacioppo1982,0.93,1,Love to read challenging material.,Need for Cognition
Cacioppo1982,0.93,1,Love to think up new ways of doing things.,Need for Cognition
Cacioppo1982,0.93,1,Need things explained only once.,Need for Cognition
Cacioppo1982,0.93,-1,Try to avoid complex people.,Need for Cognition
CAT-PD,"0.82,0.84",1,Act without planning.,Non-Planfulness
CAT-PD,"0.85,0.83",1,Am a cold-hearted person.,Callousness
CAT-PD,"0.82,0.84",-1,Am a firm believer in thinking things through.,Non-Planfulness
CAT-PD,"0.83,0.84",-1,Am a law-abiding citizen.,Norm Violation
CAT-PD,"0.86,0.82",1,Am a strange person.,Peculiarity
CAT-PD,"0.82,0.85",-1,Am a very reliable person.,Irresponsibility
CAT-PD,"0.83,0.85",1,"Am a workaholic, with little time for fun or pleasure.",Workaholism
CAT-PD,"0.82,0.86",-1,Am able to describe my feelings easily.,Emotional Detachment
CAT-PD,"0.83,0.84",1,Am able to read the minds of others.,Irrational Beliefs
CAT-PD,"0.84,0.84",1,Am afraid that my life will be cut short by illness.,Health Anxiety
CAT-PD,"0.84,0.83",1,Am always worried that my partner is going to leave me.,Relationship Insecurity
CAT-PD,"0.84,0.89",-1,Am an energetic person.,Anhedonia
CAT-PD,"0.88,0.85",-1,Am an honest person.,Manipulativeness
CAT-PD,"0.86,0.82",1,Am considered to be kind of eccentric.,Peculiarity
CAT-PD,"0.77,0.80",1,Am convinced that my way is the best way.,Rigidity
CAT-PD,"0.81,0.85",1,Am easily controlled by others in my life.,Submissiveness
CAT-PD,"0.82,0.88",1,Am easily disoriented.,Cognitive Problems
CAT-PD,"0.83,0.88",1,Am easily distracted.,Non-Perseverance
CAT-PD,"0.83,0.85",1,Am easily startled.,Anxiety
CAT-PD,"0.82,0.86",1,Am emotionally reserved.,Emotional Detachment
CAT-PD,"0.82,0.87",1,Am excited to inflict pain on others.,Hostile Aggression
CAT-PD,"0.83,0.85",1,Am generally a fearful person.,Anxiety
CAT-PD,"0.85,0.83",1,Am indifferent to the feelings of others.,Callousness
CAT-PD,"0.77,0.80",1,Am inflexible when I think I'm right.,Rigidity
