instrument,alpha,key,text,label
CPI,0.71,1,Have a lot of fun.,Adventurousness
CPI,0.82,-1,Have a low opinion of myself.,Forcefulness
CPI,0.78,1,Have a vivid imagination.,Insight
CPI,0.83,-1,Have days when I'm mad at the world.,Amiability
CPI,0.87,-1,Have difficulty expressing my feelings.,Sociability
CPI,0.78,-1,Have difficulty imagining things.,Insight
CPI,0.81,1,Have excellent ideas.,Self-efficacy
CPI,0.66,-1,Have frequent mood swings.,Calmness
CPI,0.78,-1,Have little to contribute.,Insight
CPI,0.87,-1,Have little to say.,Sociability
CPI,0.69,-1,Hide my real intentions.,Depth
CPI,0.82,1,Impose my will on others.,Dominance
CPI,0.82,1,Impose my will on others.,Assertiveness
CPI,0.66,-1,Judge myself more harshly than others do.,Calmness
CPI,0.85,1,Keep in the background.,Introversion
CPI,0.8,1,Keep my cool.,Hope/Optimism
CPI,0.75,1,Keep my promises.,Temperance
CPI,0.7,-1,Know how things work.,Sentimentality
CPI,0.77,-1,Know how to get around the rules.,Timidity
CPI,0.74,-1,Know that I am not a special person.,Competence
CPI,0.8,1,Know the answers to many questions.,Comprehension
CPI,0.77,-1,Laugh at others.,Timidity
CPI,0.82,1,Lay down the law to others.,Dominance
CPI,0.82,1,Lay down the law to others.,Assertiveness
CPI,0.8,1,Leave a mess in my room.,Disorderliness
CPI,0.81,-1,Let myself be directed by others.,Self-efficacy
CPI,0.71,1,Let myself go.,Adventurousness
CPI,0.81,-1,Let others determine my choices.,Self-efficacy
CPI,0.8,-1,Like order.,Disorderliness
CPI,0.66,1,Like to be of service to others.,Responsibility
CPI,0.75,1,Like to organize things.,Self-discipline
CPI,0.85,-1,Like to stand during the national anthem.,Liberalism
CPI,0.7,-1,Live in a world of my own.,Stability
CPI,0.62,1,Look at the facts.,Planfulness
CPI,0.69,-1,Look down on any weakness.,Tolerance
CPI,0.66,-1,Look for hidden meanings in things.,Calmness
CPI,0.7,1,Love flowers.,Sentimentality
CPI,0.77,1,Love life.,Happiness
CPI,0.8,-1,Love order and regularity.,Disorderliness
CPI,0.75,-1,Love to come up with objections.,Temperance
CPI,0.71,-1,Make a lot of noise.,Self-control/Self-regulation
CPI,0.7,-1,Make enemies.,Stability
CPI,0.69,1,Make people feel at ease.,Depth
CPI,0.73,1,Make plans and stick to them.,Dutifulness
CPI,0.71,-1,Make rash decisions.,Self-control/Self-regulation
CPI,0.79,-1,Mess things up.,Poise
CPI,0.79,1,Need things explained only once.,Poise
CPI,0.81,-1,Never challenge things.,Self-efficacy
CPI,0.71,1,Never spend more than I can afford.,Self-control/Self-regulation
CPI,0.77,-1,Often express doubts.,Good Nature
CPI,0.84,-1,Often feel blue.,Security
CPI,0.87,-1,Often feel uncomfortable around others.,Sociability
CPI,0.8,1,Often forget to put things back in their proper place.,Disorderliness
CPI,0.87,-1,Only feel comfortable with friends.,Sociability
CPI,0.73,-1,Overuse my credit.,Dutifulness
CPI,0.79,-1,Panic easily.,Poise
CPI,0.79,1,Pay attention to details.,Poise
CPI,0.77,-1,Play tricks on others.,Timidity
CPI,0.85,-1,Prefer to stick with things that I know.,Intellect
CPI,0.78,1,Put a new perspective on things.,Insight
CPI,0.69,-1,Put down others' proposals.,Tolerance
CPI,0.82,1,Put people under pressure.,Dominance
CPI,0.82,1,Put people under pressure.,Assertiveness
CPI,0.74,-1,Question my ability to do my work properly.,Competence
CPI,0.83,1,Rarely complain.,Amiability
CPI,0.83,1,Rarely get irritated.,Amiability
CPI,0.75,1,Rarely overindulge.,Temperance
CPI,0.69,-1,Rarely smile.,Depth
CPI,0.66,-1,React intensely.,Calmness
CPI,0.8,1,Read quickly.,Comprehension
CPI,0.82,1,Readily overcome setbacks.,Forcefulness
CPI,0.79,1,Remain calm under pressure.,Poise
CPI,0.7,1,Remember my friends' birthdays.,Sentimentality
CPI,0.64,1,Respect the opinions of others.,Politeness
CPI,0.84,-1,Retreat from others.,Security
CPI,0.66,1,Return extra change when a cashier makes a mistake.,Responsibility
CPI,0.75,-1,Say inappropriate things.,Temperance
CPI,0.78,-1,Say nothing new.,Insight
CPI,0.64,-1,Scheme against others.,Politeness
CPI,0.8,-1,See difficulties everywhere.,Hope/Optimism
CPI,0.77,-1,See other people as my competitors.,Good Nature
CPI,0.8,-1,See that rules are observed.,Disorderliness
CPI,0.69,1,See the humor in situations.,Depth
CPI,0.77,-1,Seek danger.,Timidity
CPI,0.85,-1,Seek to influence others.,Introversion
CPI,0.84,1,Seldom feel blue.,Security
CPI,0.83,1,Seldom get mad.,Amiability
CPI,0.71,-1,Seldom joke around.,Adventurousness
CPI,0.83,1,Seldom take offense.,Amiability
CPI,0.8,-1,Skip difficult words while reading.,Comprehension
CPI,0.7,-1,Snap at people.,Stability
CPI,0.73,-1,Spend more money than I have.,Dutifulness
CPI,0.87,1,Start conversations.,Sociability
CPI,0.62,1,Stick to my chosen path.,Planfulness
CPI,0.77,1,Stick to the rules.,Timidity
CPI,0.75,-1,Suddenly lose interest.,Temperance
CPI,0.7,1,Suffer from others' sorrows.,Sentimentality
CPI,0.83,-1,Suspect hidden motives in others.,Amiability
CPI,0.7,1,Sympathize with others' feelings.,Sentimentality
CPI,0.69,1,Sympathize with the homeless.,Tolerance
CPI,0.85,-1,Take charge.,Introversion
CPI,0.8,-1,Take offense easily.,Hope/Optimism
CPI,0.66,1,Take others' interests into account.,Responsibility
CPI,0.82,1,Take the initiative.,Forcefulness
CPI,0.87,1,Talk to a lot of different people at parties.,Sociability
CPI,0.85,-1,Tend to vote for conservative political candidates.,Liberalism
CPI,0.85,1,Tend to vote for liberal political candidates.,Liberalism
CPI,0.84,1,Think highly of myself.,Security
CPI,0.81,1,Think quickly.,Self-efficacy
CPI,0.78,1,Throw a new light on the situation.,Insight
CPI,0.69,-1,Treat people as inferiors.,Tolerance
CPI,0.7,1,Trust others.,Stability
CPI,0.66,-1,Try not to think about the needy.,Responsibility
CPI,0.71,1,Try out new things.,Adventurousness
CPI,0.66,1,Try to forgive and forget.,Responsibility
CPI,0.82,1,Try to outdo others.,Dominance
CPI,0.82,1,Try to outdo others.,Assertiveness
CPI,0.82,1,Try to surpass others' accomplishments.,Dominance
CPI,0.82,1,Try to surpass others' accomplishments.,Assertiveness
CPI,0.73,1,Understand people who think differently.,Complexity
CPI,0.81,-1,Undertake few things on my own.,Self-efficacy
CPI,0.71,-1,Use flattery to get ahead.,Self-control/Self-regulation
CPI,0.71,-1,Use swear words.,Self-control/Self-regulation
CPI,0.8,-1,Want everything to add up perfectly.,Disorderliness
CPI,0.8,-1,Want everything to be just right.,Disorderliness
CPI,0.85,-1,Want to be in charge.,Introversion
CPI,0.82,1,Want to control the conversation.,Dominance
CPI,0.82,1,Want to control the conversation.,Assertiveness
CPI,0.69,1,Want to increase my knowledge.,Depth
CPI,0.75,-1,Waste my time.,Self-discipline
CPI,0.78,-1,Would describe my experiences as somewhat dull.,Insight
CPI,0.73,1,Would never cheat on my taxes.,Dutifulness
CPI,0.77,1,Would never go hang gliding or bungee jumping.,Timidity
Foa1998,0.82,1,Am afraid that I will do the wrong thing.,Perfectionism
Foa1998,0.82,1,Am filled with doubts about things.,Perfectionism
Foa1998,0.81,-1,Am not bothered by disorder.,Need for Order and Cleanliness
Foa1998,0.81,-1,Am not bothered by messy people.,Need for Order and Cleanliness
Foa1998,0.82,-1,Complete tasks successfully.,Perfectionism
Foa1998,0.81,1,Continue until everything is perfect.,Need for Order and Cleanliness
Foa1998,0.82,1,Dislike myself.,Perfectionism
Foa1998,0.82,1,Excel in nothing at all.,Perfectionism
Foa1998,0.82,-1,Feel comfortable with myself.,Perfectionism
Foa1998,0.81,1,Follow a schedule.,Need for Order and Cleanliness
Foa1998,0.81,-1,Leave a mess in my room.,Need for Order and Cleanliness
Foa1998,0.81,-1,Leave my belongings around.,Need for Order and Cleanliness
Foa1998,0.81,1,Like order.,Need for Order and Cleanliness
Foa1998,0.81,1,Like to tidy up.,Need for Order and Cleanliness
Foa1998,0.82,1,Mess things up.,Perfectionism
Foa1998,0.82,1,Question my ability to do my work properly.,Perfectionism
Foa1998,0.82,-1,Remain calm under pressure.,Perfectionism
Foa1998,0.82,-1,Seldom feel blue.,Perfectionism
Foa1998,0.81,1,Want everything to add up perfectly.,Need for Order and Cleanliness
Foa1998,0.81,1,Want everything to be just right.,Need for Order and Cleanliness
Foa2002,0.87,1,Am considered attractive by others.,Physical Attractiveness
Foa2002,0.87,1,Attract attention from the opposite sex.,Physical Attractiveness
Foa2002,0.87,1,Check on things more often than necessary.,Obsessive-Compulsive Symptoms
Foa2002,0.87,-1,Dislike looking at my body.,Physical Attractiveness
Foa2002,0.87,-1,Dislike looking at myself in the mirror.,Physical Attractiveness
Foa2002,0.87,-1,Don't consider myself attractive.,Physical Attractiveness
Foa2002,0.87,1,Feel that I have to repeat certain numbers.,Obsessive-Compulsive Symptoms
Foa2002,0.87,1,Feel that there are good and bad numbers.,Obsessive-Compulsive Symptoms
Foa2002,0.87,1,Find it difficult to touch an object that has been touched by other,Obsessive-Compulsive Symptoms
Foa2002,0.87,1,Get upset by unpleasant thoughts that come into my mind.,Obsessive-Compulsive Symptoms
Foa2002,0.87,1,Get upset if objects are not arranged properly.,Obsessive-Compulsive Symptoms
Foa2002,0.87,1,Get upset if others change the way that I have arranged things.,Obsessive-Compulsive Symptoms
Foa2002,0.87,1,Have a pleasing physique.,Physical Attractiveness
Foa2002,0.87,1,Have difficulty getting rid of nasty thoughts.,Obsessive-Compulsive Symptoms
Foa2002,0.87,1,Like to look at my body.,Physical Attractiveness
Foa2002,0.87,1,Like to look at myself in the mirror.,Physical Attractiveness
Foa2002,0.87,1,Like to show off my body.,Physical Attractiveness
Foa2002,0.87,1,Need things to be arranged in a particular order.,Obsessive-Compulsive Symptoms
Foa2002,0.87,1,"Repeatedly check doors, windows, and drawers.",Obsessive-Compulsive Symptoms
Foa2002,0.87,1,Sometimes have to clean myself simply because I feel contaminated.,Obsessive-Compulsive Symptoms
Foa2002,0.87,1,Wash my hands more often than is necessary.,Obsessive-Compulsive Symptoms
Goldberg1999,0.9,1,Drove or rode somewhere without remembering later what happened during all or part of the trip.,Dissociation
Goldberg1999,0.9,1,Felt as though I was looking at the world through a fog so that people and objects appeared far away or unclear.,Dissociation
Goldberg1999,0.9,1,Felt like I was disconnected from my body.,Dissociation
Goldberg1999,0.9,1,Felt like I was dreaming when I was awake.,Dissociation
Goldberg1999,0.9,1,Felt that I could not move my hands or feet.,Dissociation
Goldberg1999,0.9,1,"Find that I sometimes sit staring off into space, thinking of nothing, and am not aware of the passage of time.",Dissociation
Goldberg1999,0.9,1,Find that in certain situations I am able to do things with amazing ease and spontaneity that would usually be difficult for me.,Dissociation
Goldberg1999,0.9,1,Find that in one situation I act so differently from when I'm in another situation that I feel almost as if I were two different people.,Dissociation
Goldberg1999,0.9,1,Found evidence that I had done things that I did not remember doing.,Dissociation
Goldberg1999,0.9,1,Found myself dressed in clothes I didn't remember putting on.,Dissociation
Goldberg1999,0.9,1,Found myself in a place and had no idea how I had gotten there.,Dissociation
Goldberg1999,0.9,1,Found new things among my belongings that I didn't remember buying.,Dissociation
Goldberg1999,0.9,1,Found that I became so involved in a fantasy or daydream that it felt like it was really happening to me.,Dissociation
Goldberg1999,0.9,1,Found that I could not remember whether I had done something or had just thought about doing that thing.,Dissociation
Goldberg1999,0.9,1,"Found that I had no memory for some important event in my life (for example, a wedding or graduation).",Dissociation
Goldberg1999,0.9,1,Found that I heard voices inside my head that told me to do things or commented on things that I was doing.,Dissociation
Goldberg1999,0.9,1,Found that I was able to ignore pain.,Dissociation
Goldberg1999,0.9,1,Found that when I was watching television or a movie I became so absorbed in the story that I was unaware of other events happening around me.,Dissociation
Goldberg1999,0.9,1,"Found writings, drawings, or notes among my belongings that I must have done but cannot remember doing.",Dissociation
Goldberg1999,0.9,1,Had the experience of being accused of lying when I did not think I had lied.,Dissociation
Goldberg1999,0.9,1,Had the experience of being in a familiar place but finding it strange and unfamiliar.,Dissociation
Goldberg1999,0.9,1,"Had the experience of feeling as though I was standing next to myself, or watching myself as if I was looking at a different person.",Dissociation
Goldberg1999,0.9,1,Had the experience of feeling that my body did not belong to me.,Dissociation
Goldberg1999,0.9,1,"Had the experience of feeling that other people, objects, and the world around me were not real.",Dissociation
Goldberg1999,0.9,1,Had the experience of looking in a mirror and not recognizing myself.,Dissociation
Goldberg1999,0.9,1,"Had the experience of not being sure whether things I remember happening really did happen, or whether I just dreamed them.",Dissociation
Goldberg1999,0.9,1,Had the experience of remembering a past event so vividly that it felt like I was reliving that event.,Dissociation
Goldberg1999,0.9,1,Talked out loud to myself.,Dissociation
Goldberg1999,0.9,1,Was approached by someone I didn't know who called me by another name or who insisted that he or she had met me before.,Dissociation
Goldberg1999,0.9,1,Was listening to someone talk and suddenly realized I did not hear part or all of what was said.,Dissociation
Goldberg1999,0.9,1,Was told that I sometimes do not recognize a friend or family member.,Dissociation
HEXACO_PI,0.81,1,Accept people as they are.,Gentleness
HEXACO_PI,0.8,-1,Act impulsively when something is bothering me.,Prudence
HEXACO_PI,0.81,-1,Act like different people in different situations.,Sincerity
HEXACO_PI,0.73,1,Adjust easily.,Flexibility
HEXACO_PI,0.77,-1,Admire a really clever scam.,Equity/Fairness
HEXACO_PI,0.84,1,Am a physical coward.,Fearfulness
HEXACO_PI,0.73,-1,Am annoyed by others' mistakes.,Flexibility
HEXACO_PI,0.84,1,Am considered to be kind of eccentric.,Unconventionality
HEXACO_PI,0.79,1,Am deeply moved by others' misfortunes.,Sentimentality
HEXACO_PI,0.88,-1,Am easily annoyed.,Patience
HEXACO_PI,0.81,1,Am exacting in my work.,Diligence
HEXACO_PI,0.85,1,Am full of ideas.,Creativity/Originality
HEXACO_PI,0.86,1,Am good at making impromptu speeches.,Social Boldness
HEXACO_PI,0.73,1,Am good at taking advice.,Flexibility
HEXACO_PI,0.73,-1,Am hard to convince.,Flexibility
HEXACO_PI,0.85,-1,Am hard to get to know.,Sociability
HEXACO_PI,0.73,-1,Am hard to reason with.,Flexibility
HEXACO_PI,0.73,-1,Am hard to satisfy.,Flexibility
HEXACO_PI,0.78,1,Am inclined to forgive others.,Forgiveness/Mercy
HEXACO_PI,0.78,1,Am interested in science.,Inquisitiveness
HEXACO_PI,0.81,1,Am just an ordinary person.,Modesty/Humility
HEXACO_PI,0.81,-1,Am likely to show off if I get the chance.,Modesty/Humility
HEXACO_PI,0.69,-1,Am mainly interested in money.,Greed Avoidance
HEXACO_PI,0.81,-1,Am more capable than most others.,Modesty/Humility
HEXACO_PI,0.84,1,Am never at a loss for words.,Expressiveness
HEXACO_PI,0.78,1,Am nice to people I should be angry at.,Forgiveness/Mercy
HEXACO_PI,0.85,-1,Am not bothered by disorder.,Organization
HEXACO_PI,0.85,-1,Am not easily disturbed by events.,Anxiety
HEXACO_PI,0.69,-1,Am out for my own personal gain.,Greed Avoidance
HEXACO_PI,0.81,-1,Am quick to judge others.,Gentleness
HEXACO_PI,0.79,-1,Am seldom bothered by the apparent suffering of strangers.,Sentimentality
HEXACO_PI,0.79,1,Am sensitive to the needs of others.,Sentimentality
HEXACO_PI,0.84,1,Am the life of the party.,Expressiveness
HEXACO_PI,0.88,1,Am usually a patient person.,Patience
HEXACO_PI,0.82,1,Am usually active and full of energy.,Liveliness
HEXACO_PI,0.84,-1,Am willing to take risks.,Fearfulness
HEXACO_PI,0.78,-1,Avoid difficult reading material.,Inquisitiveness
HEXACO_PI,0.8,1,Avoid mistakes.,Prudence
HEXACO_PI,0.81,-1,Become frustrated and angry with people when they don't live up to my expectations.,Gentleness
HEXACO_PI,0.84,1,Begin to panic when there is danger.,Fearfulness
HEXACO_PI,0.81,-1,Believe that I am better than others.,Modesty/Humility
HEXACO_PI,0.81,-1,Boast about my virtues.,Modesty/Humility
HEXACO_PI,0.84,-1,Bottle up my feelings.,Expressiveness
HEXACO_PI,0.73,1,Can't do without the company of others.,Conformity/Dependence/Need for approval
HEXACO_PI,0.73,-1,Can't stand being contradicted.,Flexibility
HEXACO_PI,0.85,1,Carry the conversation to a higher level.,Creativity/Originality
HEXACO_PI,0.77,-1,Cheat on people who have trusted me.,Equity/Fairness
HEXACO_PI,0.77,-1,Cheat to get ahead.,Equity/Fairness
HEXACO_PI,0.85,1,Come up with something new.,Creativity/Originality
HEXACO_PI,0.81,1,Complete tasks successfully.,Diligence
HEXACO_PI,0.81,1,Consider myself an average person.,Modesty/Humility
HEXACO_PI,0.81,-1,Criticize others' shortcomings.,Gentleness
HEXACO_PI,0.8,1,Demand quality.,Perfectionism
HEXACO_PI,0.8,1,Detect mistakes.,Perfectionism
HEXACO_PI,0.8,1,Dislike imperfect work.,Perfectionism
HEXACO_PI,0.78,-1,Distrust people.,Forgiveness/Mercy
HEXACO_PI,0.81,-1,Do just enough work to get by.,Diligence
HEXACO_PI,0.83,-1,Do not enjoy watching dance performances.,Aesthetic Appreciation/Artistic Interests
HEXACO_PI,0.85,-1,Do not have a good imagination.,Creativity/Originality
HEXACO_PI,0.83,-1,Do not like art.,Aesthetic Appreciation/Artistic Interests
HEXACO_PI,0.83,-1,Do not like concerts.,Aesthetic Appreciation/Artistic Interests
HEXACO_PI,0.8,1,Do things according to a plan.,Prudence
HEXACO_PI,0.84,1,Do things that others find strange.,Unconventionality
HEXACO_PI,0.8,-1,Do things without thinking of the consequences.,Prudence
HEXACO_PI,0.81,-1,Do too little work.,Diligence
HEXACO_PI,0.78,-1,Don't bother worrying about political and social problems.,Inquisitiveness
HEXACO_PI,0.85,-1,Don't finish the things that I start.,Organization
HEXACO_PI,0.78,-1,Don't know much about history.,Inquisitiveness
HEXACO_PI,0.8,-1,Don't know why I do some of the things I do.,Prudence
HEXACO_PI,0.84,-1,Don't like to draw attention to myself.,Expressiveness
HEXACO_PI,0.86,1,Don't mind being the center of attention.,Social Boldness
HEXACO_PI,0.81,1,Don't pretend to be more than I am.,Sincerity
HEXACO_PI,0.69,1,Don't strive for elegance in my appearance.,Greed Avoidance
HEXACO_PI,0.84,-1,Don't talk a lot.,Expressiveness
HEXACO_PI,0.81,1,Don't think that I'm better than other people.,Modesty/Humility
HEXACO_PI,0.85,1,Enjoy being part of a group.,Sociability
HEXACO_PI,0.84,-1,Enjoy being thought of as a normal mainstream person.,Unconventionality
HEXACO_PI,0.83,1,"Enjoy feeling ""close to the earth.""",Aesthetic Appreciation/Artistic Interests
HEXACO_PI,0.78,1,Enjoy intellectual games.,Inquisitiveness
HEXACO_PI,0.84,-1,Face danger confidently.,Fearfulness
HEXACO_PI,0.86,1,Feel comfortable around people.,Social Boldness
HEXACO_PI,0.82,1,Feel healthy and vibrant most of the time.,Liveliness
HEXACO_PI,0.79,1,Feel others' emotions.,Sentimentality
HEXACO_PI,0.82,1,Feel that I have a lot of inner strength.,Liveliness
HEXACO_PI,0.78,-1,Feel that most people can't be trusted.,Forgiveness/Mercy
HEXACO_PI,0.81,-1,Find fault with everything.,Gentleness
HEXACO_PI,0.86,-1,Find it difficult to approach others.,Social Boldness
HEXACO_PI,0.78,-1,Find it hard to forgive others.,Forgiveness/Mercy
HEXACO_PI,0.81,-1,Find it necessary to please the people who have power.,Sincerity
HEXACO_PI,0.78,1,Find political discussions interesting.,Inquisitiveness
HEXACO_PI,0.88,1,Find that it takes a lot to make me feel angry at someone.,Patience
HEXACO_PI,0.88,-1,Get angry easily.,Patience
HEXACO_PI,0.78,-1,Get back at people who insult me.,Forgiveness/Mercy
HEXACO_PI,0.85,1,Get chores done right away.,Organization
HEXACO_PI,0.78,-1,Get even with others.,Forgiveness/Mercy
HEXACO_PI,0.88,-1,Get irritated easily.,Patience
HEXACO_PI,0.81,1,Get started quickly on doing a job.,Diligence
HEXACO_PI,0.85,1,Get upset by unpleasant thoughts that come into my mind.,Anxiety
HEXACO_PI,0.88,-1,Get upset easily.,Patience
HEXACO_PI,0.73,-1,Get upset if others change the way that I have arranged things.,Flexibility
HEXACO_PI,0.81,-1,Hang around doing nothing.,Diligence
HEXACO_PI,0.86,-1,Hate being the center of attention.,Social Boldness
HEXACO_PI,0.81,1,Have a good word for everyone.,Gentleness
HEXACO_PI,0.82,1,Have a lot of fun.,Liveliness
HEXACO_PI,0.78,1,Have a rich vocabulary.,Inquisitiveness
HEXACO_PI,0.81,-1,Have a sharp tongue.,Gentleness
HEXACO_PI,0.69,-1,Have a strong need for power.,Greed Avoidance
HEXACO_PI,0.86,1,Have a strong personality.,Social Boldness
HEXACO_PI,0.85,1,Have a vivid imagination.,Creativity/Originality
HEXACO_PI,0.8,1,Have an eye for detail.,Perfectionism
HEXACO_PI,0.84,1,"Have an intense, boisterous laugh.",Expressiveness
HEXACO_PI,0.85,-1,Have difficulty imagining things.,Creativity/Originality
HEXACO_PI,0.85,1,Have excellent ideas.,Creativity/Originality
HEXACO_PI,0.82,1,Have great stamina.,Liveliness
HEXACO_PI,0.86,1,Have leadership abilities.,Social Boldness
HEXACO_PI,0.86,-1,Have little to say.,Social Boldness
HEXACO_PI,0.83,1,Have read the great literary classics.,Aesthetic Appreciation/Artistic Interests
HEXACO_PI,0.85,-1,Have trouble guessing how others will react.,Creativity/Originality
HEXACO_PI,0.78,-1,Hold a grudge.,Forgiveness/Mercy
HEXACO_PI,0.79,1,Immediately feel sad when hearing of an unhappy event.,Sentimentality
HEXACO_PI,0.8,-1,Jump into things without thinking.,Prudence
HEXACO_PI,0.86,-1,Keep in the background.,Social Boldness
HEXACO_PI,0.85,-1,Keep others at a distance.,Sociability
HEXACO_PI,0.85,1,Keep things tidy.,Organization
HEXACO_PI,0.84,1,Know that my ideas sometimes surprise people.,Unconventionality
HEXACO_PI,0.82,1,Laugh a lot.,Liveliness
HEXACO_PI,0.85,-1,Leave a mess in my room.,Organization
HEXACO_PI,0.85,-1,Leave my belongings around.,Organization
HEXACO_PI,0.73,1,Let myself be influenced by others.,Conformity/Dependence/Need for approval
HEXACO_PI,0.81,-1,Let people push me around to help them feel important.,Sincerity
HEXACO_PI,0.85,1,Like order.,Organization
HEXACO_PI,0.81,-1,Like to attract attention.,Modesty/Humility
HEXACO_PI,0.84,-1,Like to be thought of as a normal kind of person.,Unconventionality
HEXACO_PI,0.84,-1,Like to be viewed as proper and conventional.,Unconventionality
HEXACO_PI,0.84,-1,Like to do frightening things.,Fearfulness
HEXACO_PI,0.85,1,Like to tidy up.,Organization
HEXACO_PI,0.88,-1,Lose my temper.,Patience
HEXACO_PI,0.84,-1,Love dangerous situations.,Fearfulness
HEXACO_PI,0.69,-1,Love luxury.,Greed Avoidance
HEXACO_PI,0.78,1,Love my enemies.,Forgiveness/Mercy
HEXACO_PI,0.85,1,Love to chat.,Sociability
HEXACO_PI,0.78,1,Love to read challenging material.,Inquisitiveness
HEXACO_PI,0.85,1,Love to think up new ways of doing things.,Creativity/Originality
HEXACO_PI,0.82,1,Maintain high energy throughout the day.,Liveliness
HEXACO_PI,0.8,-1,Make a fool of myself.,Prudence
HEXACO_PI,0.8,-1,Make careless mistakes.,Prudence
HEXACO_PI,0.85,1,Make friends easily.,Sociability
HEXACO_PI,0.8,1,Make plans and stick to them.,Prudence
HEXACO_PI,0.8,-1,Make rash decisions.,Prudence
HEXACO_PI,0.73,1,Need protection.,Conformity/Dependence/Need for approval
HEXACO_PI,0.73,1,Need reassurance.,Conformity/Dependence/Need for approval
HEXACO_PI,0.73,1,Need the approval of others.,Conformity/Dependence/Need for approval
HEXACO_PI,0.82,-1,Often feel blue.,Liveliness
HEXACO_PI,0.85,-1,Often forget to put things back in their proper place.,Organization
HEXACO_PI,0.73,1,Often need help.,Conformity/Dependence/Need for approval
HEXACO_PI,0.8,1,Pay attention to details.,Perfectionism
HEXACO_PI,0.8,-1,Pay too little attention to details.,Perfectionism
HEXACO_PI,0.81,-1,Play a role in order to impress people.,Sincerity
HEXACO_PI,0.69,-1,Prefer to eat at expensive restaurants.,Greed Avoidance
HEXACO_PI,0.8,-1,Prefer to just let things happen.,Perfectionism
HEXACO_PI,0.81,-1,Pretend to be concerned for others.,Sincerity
HEXACO_PI,0.81,1,Push myself very hard to succeed.,Diligence
HEXACO_PI,0.81,-1,Put on a show to impress people.,Sincerity
HEXACO_PI,0.81,-1,Quickly lose interest in the tasks I start.,Diligence
HEXACO_PI,0.81,1,Rarely complain.,Gentleness
HEXACO_PI,0.79,-1,Rarely cry during sad movies.,Sentimentality
HEXACO_PI,0.85,-1,Rarely enjoy being with people.,Sociability
HEXACO_PI,0.88,1,Rarely feel angry with people.,Patience
HEXACO_PI,0.88,1,Rarely get irritated.,Patience
HEXACO_PI,0.73,-1,React strongly to criticism.,Flexibility
HEXACO_PI,0.84,1,Rebel against authority.,Unconventionality
HEXACO_PI,0.85,-1,Remain calm under pressure.,Anxiety
HEXACO_PI,0.77,1,Return extra change when a cashier makes a mistake.,Equity/Fairness
HEXACO_PI,0.84,-1,Say little.,Expressiveness
HEXACO_PI,0.81,1,See myself as an average person.,Modesty/Humility
HEXACO_PI,0.69,-1,Seek status.,Greed Avoidance
HEXACO_PI,0.73,1,Seek support.,Conformity/Dependence/Need for approval
HEXACO_PI,0.85,-1,Seem to derive less enjoyment from interacting with people than others do.,Sociability
HEXACO_PI,0.85,-1,Seldom experience sudden intuitive insights.,Creativity/Originality
HEXACO_PI,0.79,-1,Seldom feel weepy while reading the sad part of a story.,Sentimentality
HEXACO_PI,0.79,-1,Seldom get emotional.,Sentimentality
HEXACO_PI,0.88,1,Seldom get mad.,Patience
HEXACO_PI,0.73,1,Show my sadness.,Conformity/Dependence/Need for approval
HEXACO_PI,0.82,1,Smile a lot.,Liveliness
