instrument,alpha,key,text,label
16PF,0.78,1,Act wild and crazy.,Gregariousness
16PF,0.8,1,Am afraid that I will do the wrong thing.,Anxiety
16PF,0.76,1,Am annoyed by others' mistakes.,Emotionality
16PF,0.85,-1,Am easily discouraged.,Emotional Stability
16PF,0.8,1,Am easily hurt.,Anxiety
16PF,0.76,1,Am easily put out.,Emotionality
16PF,0.81,1,Am exacting in my work.,Orderliness
16PF,0.86,1,Am hard to get to know.,Reserve
16PF,0.81,1,Am not afraid of providing criticism.,Dominance
16PF,0.81,1,Am not afraid of providing criticism.,Assertiveness
16PF,0.81,-1,Am not bothered by disorder.,Orderliness
16PF,0.81,-1,Am not bothered by messy people.,Orderliness
16PF,0.76,-1,Am not easily annoyed.,Emotionality
16PF,0.8,-1,Am not easily bothered by things.,Anxiety
16PF,0.85,1,Am not easily frustrated.,Emotional Stability
16PF,0.82,-1,Am not interested in abstract ideas.,Complexity
16PF,0.82,-1,Am not interested in theoretical discussions.,Complexity
16PF,0.8,-1,Am not really interested in others.,Warmth
16PF,0.86,-1,Am open about my feelings.,Reserve
16PF,0.86,-1,Am open about myself to others.,Reserve
16PF,0.76,1,Am quick to judge others.,Emotionality
16PF,0.8,-1,Am quiet around strangers.,Friendliness
16PF,0.85,1,Am relaxed most of the time.,Emotional Stability
16PF,0.78,-1,Am the last to laugh at a joke.,Gregariousness
16PF,0.78,1,Am the life of the party.,Gregariousness
16PF,0.8,1,Am wary of others.,Distrust
16PF,0.86,-1,Am willing to talk about myself.,Reserve
16PF,0.78,1,Amuse my friends.,Gregariousness
16PF,0.82,-1,Avoid philosophical discussions.,Complexity
16PF,0.84,1,Believe in one true religion.,Dutifulness
16PF,0.82,1,Believe in the importance of art.,Complexity
16PF,0.84,1,Believe laws should be strictly enforced.,Dutifulness
16PF,0.8,-1,Believe that others have good intentions.,Distrust
16PF,0.8,-1,Believe that people are basically moral.,Distrust
16PF,0.8,1,Believe that people are essentially evil.,Distrust
16PF,0.8,1,Believe that people seldom tell you the whole truth.,Distrust
16PF,0.86,1,Bottle up my feelings.,Reserve
16PF,0.84,-1,Break rules.,Dutifulness
16PF,0.81,1,Can take strong measures.,Dominance
16PF,0.81,1,Can take strong measures.,Assertiveness
16PF,0.73,-1,Can't do without the company of others.,Introversion
16PF,0.76,1,Can't stand being contradicted.,Emotionality
16PF,0.82,1,Carry the conversation to a higher level.,Complexity
16PF,0.8,1,Cheer people up.,Warmth
16PF,0.76,-1,Consider myself an average person.,Intellect
16PF,0.81,1,Continue until everything is perfect.,Orderliness
16PF,0.76,1,Counter others' arguments.,Intellect
16PF,0.73,1,Cry during movies.,Sensitivity
16PF,0.86,-1,Disclose my intimate thoughts.,Reserve
16PF,0.78,-1,Dislike loud music.,Gregariousness
16PF,0.85,-1,Dislike myself.,Emotional Stability
16PF,0.73,-1,Dislike works of fiction.,Sensitivity
16PF,0.8,1,Distrust people.,Distrust
16PF,0.73,-1,Do not enjoy watching dance performances.,Sensitivity
16PF,0.73,-1,Do not like poetry.,Sensitivity
16PF,0.8,-1,Do things by the book.,Imagination
16PF,0.8,1,Do things that others find strange.,Imagination
16PF,0.8,1,Do unexpected things.,Imagination
16PF,0.8,-1,Don't let others discourage me.,Anxiety
16PF,0.73,1,Don't like action movies.,Sensitivity
16PF,0.78,-1,Don't like crowded events.,Gregariousness
16PF,0.8,-1,Don't like to get involved in other people's problems.,Warmth
16PF,0.8,1,Don't mind being the center of attention.,Friendliness
16PF,0.73,1,Don't mind eating alone.,Introversion
16PF,0.86,1,Don't talk a lot.,Reserve
16PF,0.8,-1,Don't worry about things that have already happened.,Anxiety
16PF,0.73,-1,Enjoy being part of a group.,Introversion
16PF,0.78,1,Enjoy being part of a loud crowd.,Gregariousness
16PF,0.8,1,Enjoy bringing people together.,Warmth
16PF,0.73,1,Enjoy discussing movies and books with others.,Sensitivity
16PF,0.82,1,Enjoy hearing new ideas.,Complexity
16PF,0.73,1,Enjoy my privacy.,Introversion
16PF,0.73,1,Enjoy silence.,Introversion
16PF,0.73,1,Enjoy spending time by myself.,Introversion
16PF,0.73,-1,Enjoy teamwork.,Introversion
16PF,0.8,1,Enjoy wild flights of fantasy.,Imagination
16PF,0.8,1,Feel comfortable around people.,Friendliness
16PF,0.85,1,Feel comfortable with myself.,Emotional Stability
16PF,0.8,1,Feel crushed by setbacks.,Anxiety
16PF,0.85,-1,Feel desperate.,Emotional Stability
16PF,0.8,1,"Feel guilty when I say ""no.""",Anxiety
16PF,0.8,1,Feel others' emotions.,Warmth
16PF,0.8,1,Feel threatened easily.,Anxiety
16PF,0.8,-1,Find it difficult to approach others.,Friendliness
16PF,0.8,1,Find it hard to forgive others.,Distrust
16PF,0.76,1,Get angry easily.,Emotionality
16PF,0.81,1,Get chores done right away.,Orderliness
16PF,0.76,-1,Get confused easily.,Intellect
16PF,0.76,1,Get irritated easily.,Emotionality
16PF,0.76,-1,Have a good word for everyone.,Emotionality
16PF,0.76,-1,Have a poor vocabulary.,Intellect
16PF,0.85,-1,Have frequent mood swings.,Emotional Stability
16PF,0.8,-1,Have little to say.,Friendliness
16PF,0.78,1,Joke around a lot.,Gregariousness
16PF,0.76,1,Judge people by their appearance.,Emotionality
16PF,0.8,-1,Keep in the background.,Friendliness
16PF,0.86,1,Keep my thoughts to myself.,Reserve
16PF,0.8,1,Know how to comfort others.,Warmth
16PF,0.84,-1,Know how to get around the rules.,Dutifulness
16PF,0.76,-1,Know that I am not a special person.,Intellect
16PF,0.76,1,Know the answers to many questions.,Intellect
16PF,0.76,1,Learn quickly.,Intellect
16PF,0.81,-1,Leave a mess in my room.,Orderliness
16PF,0.81,-1,Leave my belongings around.,Orderliness
16PF,0.81,-1,Let myself be pushed around.,Dominance
16PF,0.81,-1,Let myself be pushed around.,Assertiveness
16PF,0.81,-1,Let others make the decisions.,Dominance
16PF,0.81,-1,Let others make the decisions.,Assertiveness
16PF,0.81,1,Like order.,Orderliness
16PF,0.8,1,Like to get lost in thought.,Imagination
16PF,0.73,1,Like to read.,Sensitivity
16PF,0.84,1,Like to stand during the national anthem.,Dutifulness
16PF,0.73,1,Love flowers.,Sensitivity
16PF,0.78,1,Love large parties.,Gregariousness
16PF,0.8,1,Love to daydream.,Imagination
16PF,0.82,1,Love to think up new ways of doing things.,Complexity
16PF,0.8,1,Make friends easily.,Friendliness
16PF,0.76,1,Make insightful remarks.,Intellect
16PF,0.8,1,Make people feel at ease.,Warmth
16PF,0.81,-1,Never challenge things.,Dominance
16PF,0.81,-1,Never challenge things.,Assertiveness
16PF,0.85,-1,Often feel blue.,Emotional Stability
16PF,0.8,-1,Often feel uncomfortable around others.,Friendliness
16PF,0.84,-1,Oppose authority.,Dutifulness
16PF,0.73,1,Prefer to do things by myself.,Introversion
16PF,0.82,1,Prefer variety to routine.,Complexity
16PF,0.81,-1,Put off unpleasant tasks.,Orderliness
16PF,0.82,-1,Rarely look for a deeper meaning in things.,Complexity
16PF,0.73,-1,Rarely notice my emotional reactions.,Sensitivity
16PF,0.73,1,Read a lot.,Sensitivity
16PF,0.85,1,Readily overcome setbacks.,Emotional Stability
16PF,0.76,1,Reflect on things before acting.,Intellect
16PF,0.84,-1,Resist authority.,Dutifulness
16PF,0.84,1,Respect authority.,Dutifulness
16PF,0.86,1,Reveal little about myself.,Reserve
16PF,0.81,1,Say what I think.,Dominance
16PF,0.81,1,Say what I think.,Assertiveness
16PF,0.73,1,Seek quiet.,Introversion
16PF,0.8,-1,Seldom daydream.,Imagination
16PF,0.85,1,Seldom feel blue.,Emotional Stability
16PF,0.8,-1,Seldom get lost in thought.,Imagination
16PF,0.78,-1,Seldom joke around.,Gregariousness
16PF,0.86,-1,Show my feelings.,Reserve
16PF,0.76,-1,Skip difficult words while reading.,Intellect
16PF,0.8,1,Spend time thinking about past mistakes.,Anxiety
16PF,0.8,1,Start conversations.,Friendliness
16PF,0.8,1,Suspect hidden motives in others.,Distrust
16PF,0.8,1,Swim against the current.,Imagination
16PF,0.8,1,Take an interest in other people's lives.,Warmth
16PF,0.81,1,Take charge.,Dominance
16PF,0.81,1,Take charge.,Assertiveness
16PF,0.81,1,Take control of things.,Dominance
16PF,0.81,1,Take control of things.,Assertiveness
16PF,0.8,1,Take deviant positions.,Imagination
16PF,0.8,1,Take time out for others.,Warmth
16PF,0.8,1,Talk to a lot of different people at parties.,Friendliness
16PF,0.76,1,Tend to analyze things.,Intellect
16PF,0.8,-1,Trust others.,Distrust
16PF,0.8,-1,Trust what people say.,Distrust
16PF,0.8,-1,Try not to think about the needy.,Warmth
16PF,0.82,-1,Try to avoid complex people.,Complexity
16PF,0.84,1,Try to follow the rules.,Dutifulness
16PF,0.76,-1,Try to forgive and forget.,Emotionality
16PF,0.76,1,Use my brain.,Intellect
16PF,0.84,-1,Use swear words.,Dutifulness
16PF,0.81,-1,Wait for others to lead the way.,Dominance
16PF,0.81,-1,Wait for others to lead the way.,Assertiveness
16PF,0.81,1,Want to be in charge.,Dominance
16PF,0.81,1,Want to be in charge.,Assertiveness
16PF,0.73,1,Want to be left alone.,Introversion
16PF,0.76,1,Weigh the pros against the cons.,Intellect
16PF,0.8,1,Worry about things.,Anxiety
6FPQ,0.73,1,Accept people as they are.,Agreeableness
6FPQ,0.82,1,Accomplish a lot of work.,Achievement-striving
6FPQ,0.76,-1,Act quickly without thinking.,Deliberateness
6FPQ,0.73,1,Act wild and crazy.,Humor/Playfulness
6FPQ,0.59,1,Act without consulting others.,Self-Sufficiency
6FPQ,0.78,-1,Act without planning.,Methodicalness
6FPQ,0.67,1,Adapt easily to new situations.,Adaptability
6FPQ,0.67,-1,Am a bad loser.,Adaptability
6FPQ,0.7,-1,Am a creature of habit.,Adventurousness
6FPQ,0.75,1,Am always busy.,Industriousness/Perseverance/Persistence
6FPQ,0.78,1,Am always prepared.,Methodicalness
6FPQ,0.73,-1,Am annoyed by others' mistakes.,Agreeableness
6FPQ,0.7,-1,Am attached to conventional ways.,Adventurousness
6FPQ,0.81,-1,Am continually losing things.,Orderliness
6FPQ,0.59,-1,Am easily moved to tears.,Self-Sufficiency
6FPQ,0.73,-1,Am easily offended.,Agreeableness
6FPQ,0.78,1,Am exacting in my work.,Methodicalness
6FPQ,0.85,1,Am good at making impromptu speeches.,Extraversion
6FPQ,0.81,1,Am good at many things.,Resourcefulness
6FPQ,0.67,1,Am good at taking advice.,Adaptability
6FPQ,0.87,-1,Am hard to get to know.,Gregariousness
6FPQ,0.73,1,Am inclined to forgive others.,Agreeableness
6FPQ,0.8,1,Am interested in many things.,Intellectual Openness
6FPQ,0.83,1,Am likely to show off if I get the chance.,Exhibitionism
6FPQ,0.78,-1,Am not bothered by disorder.,Methodicalness
6FPQ,0.74,1,Am not concerned with making a good impression.,Unpretentiousness
6FPQ,0.73,1,Am not disturbed by events.,Agreeableness
6FPQ,0.87,1,Am not easily annoyed.,Calmness
6FPQ,0.85,-1,Am not good at getting people to like me.,Extraversion
6FPQ,0.83,-1,Am not good at telling jokes.,Exhibitionism
6FPQ,0.85,-1,Am not highly motivated to succeed.,Leadership
6FPQ,0.8,-1,Am not interested in abstract ideas.,Intellectual Openness
6FPQ,0.8,-1,Am not interested in theoretical discussions.,Intellectual Openness
6FPQ,0.8,1,Am open to change.,Intellectual Openness
6FPQ,0.73,1,Am relaxed most of the time.,Humor/Playfulness
6FPQ,0.85,1,Am skilled in handling social situations.,Extraversion
6FPQ,0.83,1,Am the life of the party.,Exhibitionism
6FPQ,0.75,1,Am under constant pressure.,Industriousness/Perseverance/Persistence
6FPQ,0.73,1,Am willing to try anything once.,Humor/Playfulness
6FPQ,0.83,1,Amuse my friends.,Exhibitionism
6FPQ,0.87,-1,Avoid company.,Gregariousness
6FPQ,0.87,-1,Avoid contacts with others.,Gregariousness
6FPQ,0.82,-1,Avoid difficult reading material.,Comprehension
6FPQ,0.82,-1,Avoid philosophical discussions.,Comprehension
6FPQ,0.69,-1,Believe appearances are important.,Independence
6FPQ,0.8,1,Believe in the importance of art.,Culture
6FPQ,0.59,1,Believe that events in my life are determined only by me.,Self-Sufficiency
6FPQ,0.8,-1,Believe that too much tax money goes to support artists.,Culture
6FPQ,0.81,1,Can handle a lot of information.,Resourcefulness
6FPQ,0.81,1,Can manage many things at the same time.,Resourcefulness
6FPQ,0.81,-1,Can never find anything.,Orderliness
6FPQ,0.81,1,Can perform a wide variety of tasks.,Resourcefulness
6FPQ,0.67,1,Can stand criticism.,Adaptability
6FPQ,0.81,1,Can tackle anything.,Resourcefulness
6FPQ,0.85,1,Can talk others into doing things.,Extraversion
6FPQ,0.81,1,Can work under pressure.,Resourcefulness
6FPQ,0.66,-1,Can't do without the company of others.,Reclusiveness
6FPQ,0.67,-1,Can't stand being contradicted.,Adaptability
6FPQ,0.8,1,Carry the conversation to a higher level.,Intellectual Openness
6FPQ,0.74,-1,Change myself to suit others.,Unpretentiousness
6FPQ,0.76,1,Choose my words with care.,Deliberateness
6FPQ,0.75,1,Complete tasks successfully.,Industriousness/Perseverance/Persistence
6FPQ,0.66,1,Dislike being complimented.,Reclusiveness
6FPQ,0.7,-1,Dislike changes.,Adventurousness
6FPQ,0.85,-1,Dislike having authority over others.,Leadership
6FPQ,0.61,1,Dislike loud music.,Conservatism
6FPQ,0.85,-1,Dislike taking responsibility for making decisions.,Leadership
6FPQ,0.7,-1,Dislike the unknown.,Adventurousness
6FPQ,0.82,1,Do a lot in my spare time.,Achievement-striving
6FPQ,0.82,-1,Do just enough work to get by.,Achievement-striving
6FPQ,0.82,1,Do more than what's expected of me.,Achievement-striving
6FPQ,0.8,-1,Do not enjoy going to art museums.,Culture
6FPQ,0.8,-1,Do not enjoy watching dance performances.,Culture
6FPQ,0.8,-1,Do not like concerts.,Culture
6FPQ,0.8,-1,Do not like poetry.,Culture
6FPQ,0.59,1,Do things men traditionally do.,Self-Sufficiency
6FPQ,0.59,1,Do things my own way.,Self-Sufficiency
6FPQ,0.81,1,Do unpleasant tasks immediately.,Orderliness
6FPQ,0.69,1,Don't care about dressing nicely.,Independence
6FPQ,0.61,-1,Don't care about rules.,Conservatism
6FPQ,0.69,1,Don't care what others think.,Independence
6FPQ,0.74,1,Don't care whether I'm considered special.,Unpretentiousness
6FPQ,0.76,-1,Don't know why I do some of the things I do.,Deliberateness
6FPQ,0.7,-1,Don't let others take credit for my work.,Docility
6FPQ,0.66,-1,Don't like being away from civilization.,Reclusiveness
6FPQ,0.83,-1,Don't like to draw attention to myself.,Exhibitionism
6FPQ,0.7,-1,Don't like to travel.,Adventurousness
6FPQ,0.83,1,Don't mind being the center of attention.,Exhibitionism
6FPQ,0.81,-1,Don't pay attention.,Resourcefulness
6FPQ,0.67,-1,Don't tolerate critics.,Adaptability
6FPQ,0.76,1,Easily resist temptations.,Deliberateness
6FPQ,0.73,1,Enjoy being reckless.,Humor/Playfulness
6FPQ,0.82,1,Enjoy discussing movies and books with others.,Comprehension
6FPQ,0.8,1,Enjoy hearing new ideas.,Culture
6FPQ,0.66,1,Enjoy spending time by myself.,Reclusiveness
6FPQ,0.82,1,Excel in what I do.,Achievement-striving
6FPQ,0.73,1,Express childlike joy.,Humor/Playfulness
6FPQ,0.85,1,Express myself easily.,Extraversion
6FPQ,0.87,1,Feel comfortable around people.,Gregariousness
6FPQ,0.69,1,Feel it's OK that some people don't like me.,Independence
6FPQ,0.75,-1,Feel that work is not an important part of my life.,Industriousness/Perseverance/Persistence
6FPQ,0.85,-1,Find it difficult to approach others.,Extraversion
6FPQ,0.82,-1,Find it difficult to get down to work.,Achievement-striving
6FPQ,0.85,1,Find it easy to manipulate others.,Leadership
6FPQ,0.82,1,Find political discussions interesting.,Comprehension
6FPQ,0.87,-1,Get angry easily.,Calmness
6FPQ,0.73,-1,Get back at others.,Agreeableness
6FPQ,0.8,1,Get excited by new ideas.,Culture
6FPQ,0.87,-1,Get irritated easily.,Calmness
6FPQ,0.87,-1,Get upset easily.,Calmness
6FPQ,0.81,-1,Give up easily.,Resourcefulness
6FPQ,0.66,1,Go my own way.,Reclusiveness
6FPQ,0.82,-1,Hang around doing nothing.,Achievement-striving
6FPQ,0.73,1,Have a lot of fun.,Humor/Playfulness
6FPQ,0.85,1,Have a natural talent for influencing people.,Extraversion
6FPQ,0.82,-1,Have a poor vocabulary.,Comprehension
6FPQ,0.82,1,Have a rich vocabulary.,Comprehension
6FPQ,0.75,-1,Have a slow pace to my life.,Industriousness/Perseverance/Persistence
6FPQ,0.85,1,Have a strong need for power.,Leadership
6FPQ,0.7,1,Have already gotten more than I deserve.,Docility
6FPQ,0.81,1,Have an eye for detail.,Orderliness
6FPQ,0.75,-1,Have extra time on my hands.,Industriousness/Perseverance/Persistence
6FPQ,0.83,-1,Have little to say.,Exhibitionism
6FPQ,0.61,1,Have no sympathy for criminals.,Conservatism
6FPQ,0.73,1,Have time for play and relaxation.,Humor/Playfulness
6FPQ,0.75,1,Have too many things to do.,Industriousness/Perseverance/Persistence
6FPQ,0.73,-1,Hold a grudge.,Agreeableness
6FPQ,0.74,-1,Judge people by their appearance.,Unpretentiousness
6FPQ,0.76,-1,Jump into things without thinking.,Deliberateness
6FPQ,0.85,-1,Keep in the background.,Extraversion
6FPQ,0.66,-1,Keep my hair fashionable.,Reclusiveness
6FPQ,0.66,-1,Keep myself well-groomed.,Reclusiveness
6FPQ,0.87,-1,Keep others at a distance.,Gregariousness
6FPQ,0.73,1,Know how to enjoy myself.,Humor/Playfulness
6FPQ,0.85,-1,Lack the talent for influencing people.,Extraversion
6FPQ,0.78,-1,Leave things unfinished.,Methodicalness
6FPQ,0.59,-1,Let myself be directed by others.,Self-Sufficiency
6FPQ,0.7,1,Let myself be used.,Docility
6FPQ,0.73,1,Let myself go.,Humor/Playfulness
6FPQ,0.7,1,Let other people take the credit for my work.,Docility
6FPQ,0.61,-1,Let others down.,Conservatism
6FPQ,0.7,1,Let people push me around to help them feel important.,Docility
6FPQ,0.85,1,Like having authority over others.,Leadership
6FPQ,0.8,1,Like music.,Culture
6FPQ,0.78,1,Like order.,Methodicalness
6FPQ,0.76,-1,Like to act on a whim.,Deliberateness
6FPQ,0.83,1,Like to attract attention.,Exhibitionism
6FPQ,0.66,1,Like to be alone.,Reclusiveness
6FPQ,0.61,1,Like to follow a regular schedule.,Conservatism
6FPQ,0.82,1,Like to read.,Comprehension
6FPQ,0.81,1,Like to solve complex problems.,Resourcefulness
6FPQ,0.81,1,Like to tidy up.,Orderliness
6FPQ,0.7,1,Like to visit new places.,Adventurousness
6FPQ,0.66,1,Live in a world of my own.,Reclusiveness
6FPQ,0.87,-1,Lose my temper.,Calmness
6FPQ,0.73,1,Love excitement.,Humor/Playfulness
6FPQ,0.69,-1,Love to be complimented.,Independence
6FPQ,0.8,1,Love to learn new things.,Culture
6FPQ,0.82,1,Love to read challenging material.,Comprehension
6FPQ,0.78,-1,Make a mess of things.,Methodicalness
6FPQ,0.59,1,Make decisions quickly.,Self-Sufficiency
6FPQ,0.87,1,Make friends easily.,Gregariousness
6FPQ,0.76,-1,Make rash decisions.,Deliberateness
6FPQ,0.78,-1,Mess things up.,Methodicalness
6FPQ,0.82,-1,Need a push to get started.,Achievement-striving
6FPQ,0.59,-1,Need protection.,Self-Sufficiency
6FPQ,0.69,-1,Need reassurance.,Independence
6FPQ,0.69,-1,Need the approval of others.,Independence
6FPQ,0.81,1,Need things explained only once.,Resourcefulness
6FPQ,0.87,-1,Often feel uncomfortable around others.,Gregariousness
6FPQ,0.81,1,Often forget to put things back in their proper place.,Orderliness
6FPQ,0.59,-1,Often need help.,Self-Sufficiency
6FPQ,0.61,-1,Oppose authority.,Conservatism
6FPQ,0.78,1,Pay attention to details.,Methodicalness
6FPQ,0.82,1,Plunge into tasks with all my heart.,Achievement-striving
6FPQ,0.66,1,Prefer to do things by myself.,Reclusiveness
6FPQ,0.8,-1,Prefer to stick with things that I know.,Intellectual Openness
6FPQ,0.8,1,Prefer variety to routine.,Intellectual Openness
6FPQ,0.67,-1,Put down others' proposals.,Adaptability
6FPQ,0.75,-1,Put little time and effort into my work.,Industriousness/Perseverance/Persistence
6FPQ,0.74,-1,Put on a show to impress people.,Unpretentiousness
6FPQ,0.7,1,Put up with anything.,Docility
6FPQ,0.75,1,Put work above pleasure.,Industriousness/Perseverance/Persistence
6FPQ,0.87,1,Rarely complain.,Calmness
6FPQ,0.87,1,Rarely get irritated.,Calmness
6FPQ,0.8,-1,Rarely look for a deeper meaning in things.,Intellectual Openness
6FPQ,0.87,1,Rarely lose my composure.,Calmness
6FPQ,0.76,1,Remain calm under pressure.,Deliberateness
6FPQ,0.61,1,Respect authority.,Conservatism
6FPQ,0.76,-1,Rush into things.,Deliberateness
6FPQ,0.69,1,Sail my own course.,Independence
6FPQ,0.85,1,See myself as a good leader.,Leadership
6FPQ,0.7,1,Seek adventure.,Adventurousness
6FPQ,0.74,-1,Seek status.,Unpretentiousness
6FPQ,0.69,-1,Seek support.,Independence
6FPQ,0.87,1,Seldom get mad.,Calmness
6FPQ,0.82,-1,Shirk my duties.,Achievement-striving
6FPQ,0.82,1,Show a mastery of language.,Comprehension
6FPQ,0.87,-1,Snap at people.,Calmness
6FPQ,0.82,1,Spend a lot of time reading.,Comprehension
6FPQ,0.87,1,Start conversations.,Gregariousness
6FPQ,0.76,1,Take care of my own affairs.,Deliberateness
6FPQ,0.73,1,Take things as they come.,Agreeableness
6FPQ,0.59,-1,Talk about my worries.,Self-Sufficiency
6FPQ,0.87,1,Talk to a lot of different people at parties.,Gregariousness
6FPQ,0.73,1,Tolerate a lot from others.,Agreeableness
6FPQ,0.8,-1,Try to avoid complex people.,Intellectual Openness
6FPQ,0.7,1,Try to do too difficult things.,Adventurousness
6FPQ,0.73,1,Try to forgive and forget.,Agreeableness
6FPQ,0.74,-1,Try to impress others.,Unpretentiousness
6FPQ,0.85,1,Try to lead others.,Leadership
6FPQ,0.85,-1,Wait for others to lead the way.,Leadership
6FPQ,0.78,1,Want everything to be just right.,Methodicalness
6FPQ,0.61,1,Want things to proceed according to plan.,Conservatism
6FPQ,0.74,-1,Want to amount to something special in others' eyes.,Unpretentiousness
6FPQ,0.85,1,Want to be in charge.,Leadership
6FPQ,0.69,-1,Want to be liked.,Independence
6FPQ,0.67,-1,Want to have the last word.,Adaptability
6FPQ,0.8,1,Want to increase my knowledge.,Intellectual Openness
6FPQ,0.87,1,Warm up quickly to others.,Gregariousness
6FPQ,0.7,1,Will agree to anything.,Docility
6FPQ,0.7,-1,Won't take the blame for something that's not my fault.,Docility
6FPQ,0.75,1,Work hard.,Industriousness/Perseverance/Persistence
6FPQ,0.74,-1,Worry about what people think of me.,Unpretentiousness
6FPQ,0.85,-1,Would describe my experiences as somewhat dull.,Extraversion
6FPQ,0.7,1,Would like to live for awhile in a different country.,Adventurousness
6FPQ,0.83,1,Would make a good actor.,Exhibitionism
6FPQ,0.7,-1,Would never go hang-gliding or bungee-jumping.,Adventurousness
6FPQ,0.83,-1,Would not be a good comedian.,Exhibitionism
7FACTOR,0.75,-1,Act wild and crazy.,Conscientiousness
7FACTOR,0.77,1,Am concerned about others.,Agreeableness
7FACTOR,0.86,1,Am not easily bothered by things.,Emotional Stability
7FACTOR,0.66,-1,Am not highly motivated to succeed.,Attractiveness
7FACTOR,0.84,-1,Am not interested in abstract ideas.,Intellect
7FACTOR,0.77,-1,Am not interested in other people's problems.,Agreeableness
7FACTOR,0.86,-1,Am often down in the dumps.,Emotional Stability
7FACTOR,0.82,1,Am open about my feelings.,Extraversion
7FACTOR,0.84,-1,Avoid difficult reading material.,Intellect
7FACTOR,0.75,1,Believe laws should be strictly enforced.,Conscientiousness
7FACTOR,0.66,1,Believe that I am important.,Attractiveness
7FACTOR,0.75,-1,Break rules.,Conscientiousness
7FACTOR,0.84,1,Carry the conversation to a higher level.,Intellect
7FACTOR,0.72,1,Change myself to suit others.,Negative-Valence
7FACTOR,0.72,1,Conform to others' opinions.,Negative-Valence
7FACTOR,0.72,1,Copy others.,Negative-Valence
7FACTOR,0.72,1,Demand attention.,Negative-Valence
7FACTOR,0.75,-1,Do crazy things.,Conscientiousness
7FACTOR,0.75,1,Do things by the book.,Conscientiousness
7FACTOR,0.75,-1,Do things in a half-way manner.,Conscientiousness
7FACTOR,0.66,-1,Don't care about dressing nicely.,Attractiveness
7FACTOR,0.66,-1,Don't like to get dressed up.,Attractiveness
7FACTOR,0.82,-1,Don't talk a lot.,Extraversion
7FACTOR,0.77,1,Feel others' emotions.,Agreeableness
7FACTOR,0.77,-1,Find fault with everything.,Agreeableness
7FACTOR,0.86,-1,Get stressed out easily.,Emotional Stability
7FACTOR,0.66,1,Get things done quickly.,Attractiveness
7FACTOR,0.84,1,Have a rich vocabulary.,Intellect
7FACTOR,0.77,1,Have a soft heart.,Agreeableness
7FACTOR,0.82,-1,Have difficulty expressing my feelings.,Extraversion
7FACTOR,0.84,-1,Have difficulty understanding abstract ideas.,Intellect
7FACTOR,0.84,1,Have excellent ideas.,Intellect
7FACTOR,0.82,-1,Hold back my opinions.,Extraversion
7FACTOR,0.77,-1,Insult people.,Agreeableness
7FACTOR,0.72,1,Interfere in other people's business.,Negative-Valence
7FACTOR,0.75,-1,Jump into things without thinking.,Conscientiousness
7FACTOR,0.66,1,Keep improving myself.,Attractiveness
7FACTOR,0.66,1,Keep myself well-groomed.,Attractiveness
7FACTOR,0.66,-1,Know that I am not a special person.,Attractiveness
7FACTOR,0.75,1,Like order.,Conscientiousness
7FACTOR,0.66,1,Like to tidy up.,Attractiveness
7FACTOR,0.82,1,Make friends easily.,Extraversion
7FACTOR,0.77,1,Make people feel at ease.,Agreeableness
7FACTOR,0.72,1,Need the approval of others.,Negative-Valence
7FACTOR,0.82,1,Never at a loss for words.,Extraversion
7FACTOR,0.75,1,Pay attention to details.,Conscientiousness
7FACTOR,0.66,-1,Pay no attention to my appearance.,Attractiveness
7FACTOR,0.77,-1,Put people under pressure.,Agreeableness
7FACTOR,0.84,1,Quick to understand things.,Intellect
7FACTOR,0.82,-1,Speak softly.,Extraversion
7FACTOR,0.77,1,Sympathize with others' feelings.,Agreeableness
7FACTOR,0.77,-1,Take advantage of others.,Agreeableness
7FACTOR,0.82,1,Take charge.,Extraversion
7FACTOR,0.86,1,Take things as they come.,Emotional Stability
7FACTOR,0.72,1,Talk mainly about myself.,Negative-Valence
7FACTOR,0.82,1,Talk to a lot of different people at parties.,Extraversion
7FACTOR,0.84,-1,Try to avoid complex people.,Intellect
7FACTOR,0.75,1,Try to follow the rules.,Conscientiousness
7FACTOR,0.72,1,Try to impress others.,Negative-Valence
7FACTOR,0.72,1,Want to be told I am right.,Negative-Valence
7FACTOR,0.72,1,Want to prove myself.,Negative-Valence
7FACTOR,0.84,-1,Will not probe deeply into a subject.,Intellect
